author,url,text
Sabelo Nsele,https://www.isolezwe.co.za/izindaba/2026-05-13-ikhuthaza-imfundo-kozakwabo-imeya-ethweswe-iziqu/,"UMNUZ Melikhaya Ngcongo IBONA ukufunda kwezimeya kungaba yikhambi elingaqeda idimoni lokungalandelwa kwemigomo komasipala baKwaZulu-Natal iMeya kaMasipala waseRichmond esanda kuthweswa iziqu zemfundo ephakeme, uMnuz Melikhaya Ngcongo. UNgcongo uthe ukuncipha kwezimeya ezingaziboni izimpukane kuzokwenza ukuthi banciphe nomasipala abathola imibiko enogcobho. Ukusho lokhu engxoxweni abe nayo neSolezwe. UNgcongo usanda kuthweswa iziqu iPost Graduate Diploma in Public Management eNyuvesi yasePitoli. Umasipala awuphethe wenza kahle kakhulu ekuphathweni kwemali njengoba uyingxenye yomasipala abane baKwaZulu-Natal abathole imibiko engenagcobho ngonyaka odlule. Bekungunyaka wesibili umasipala uthola umbiko ongenawo ugcobho, kanti lona ngunyaka wesithathu uNgcongo esesihlalweni. UNgcongo uthe kuba lula ukuthi izikhulu zizenzele umathanda uma imeya ingayazi imithetho eyengamele ukusetshenziswa kwemali. ""Uma uyimeya uwena ongusihlalo wekomiti lezezimali kumasipala. Uma imeya ingaziboni izimpukane kuzokonakala. Izikhulu zizozenzela umathanda. Ngeke sifunde sonke siyizimeya, kodwa labo ithuba elisavuma kubona kufanele baye kofunda. Uma uwumholi kufanele uwazi umsebenzi wezikhulu zomasipala kanye nemithetho ethinta ukuphathwa kwemikhandlu. Ugcina uvuma noma izikhulu sezenza izinto ezingalungile uma ungayazi imithetho."" UNgcongo uthe izimeya kufanele ziqinisekise ukulandelwa kwemithetho uma zifuna ukuthola imibiko engenagcobho. ""Ngeke uwuthole umbiko ongenagcobho uma ungathembekile. Kufanele uqashe abantu abawaziyo umsebenzi. Omasipala abaningi bathola imibiko enogcobho ngenxa yokuthi abayilandeli imigomo uma besebenzisa imali. Inkinga enkulu ilapha ophikweni okukhishwa kulo amathenda."" UNgcongo uthe usaphokophele ukuthola ezinye iziqu zemfundo ephakeme. ""Uma uwumholi kubalulekile ukuthi uzithuthukise ngolwazi. Ngesikhathi ngiqokelwa ukuphatha umasipala ngo-2023 ngabona ukuthi kuningi engingakwazi mayelana nokuphathwa komasipala kanye nokusetshenziswa kwemali yomphakathi."" UNgcongo uthe uyaqhubeka nezifundo zakhe njengoba manje esenza iMasters. Ebuzwa ukuthi ngabe ufisa ukufinyelela eziqwini zobudokotela yini uthe uzofinyelela uma iNkosi ivuma. UNgcongo uthe bekungelula ukuqhuba iziqu zemfundo ephakeme. ""NgesiZulu nje ngingathi ibingitibulisa, namanje ngisaqhubeka nokutibula ngoba ngisaqhubeka nokufunda. Akulula ukucaza isikhathi sakho njengoba bengifunda ngisebenza. Ukuzimisela kwami yikhona okwenze ukuthi ngigcine ngiphumelela."""
Sabelo Nsele,https://www.isolezwe.co.za/izindaba/2026-05-12-kushone-obemele-i-da-embangweni-wesobumeya/,"UMNUZ Christo Botha obemele i-DA embangweni wesikhundla sobumeya kuMasipala waseMhlathuze KUSHONE obemele i-DA embangweni wesikhundla sobumeya kuMasipala waseMhlathuze, uMnuz Christo Botha. UBotha, obeyiphini lemeya kuMasipala waseMhlathuze, ushone emva kokuxinwa ukugula. Izindaba zokushona kwakhe zimenyezelwe ngumholi we-DA KwaZulu-Natal, uMnuz Sithembiso Ngema. UNgema uthe bagqemeke engeqiwa ntwala ngokushona kukaBotha. ""Asilahlekelwanga nje iphini lemeya kodwa silahlekelwe umholi obesebenzela abantu. Uyena obezomela i-DA embangweni wesikhundla sobumeya eMhlathuze njengoba kuza ukhetho lohulumeni basekhaya. Angeke siwakhohlwe amagalelo akhe kuMasipala waseMhlathuze  nokulwela kwakhe abantu baseMhlathuze."" UBotha ubephinde abe yikhansela lakuWard 2. USomlomo womkhandlu, uMnuz Tobias Gumede, unxuse abantu abahlala kuWard 2 abadinga usizo lomkhandlu ukuba bathinte ihhovisi lakhe namalungu ekomiti lekhansela kuWard 2 ukuze ezothola usizo. UGumende udlulise amazwi enduduzo emndenini kaBotha."
Sabelo Nsele,https://www.isolezwe.co.za/izindaba/2026-05-12-uhlabisa-uphikisa-isiphakamiso-sokungamethembi-uramaphosa/,"UMHOLI we-IFP, uMnuz Velenkosini Hlabisa Image: Leon Lestrade / Independent Media UMHOLI we-IFP, uMnuz Velenkosini Hlabisa, uthe ngeke baseseke isiphakamiso sokungabethembi ubuholi bukaMengameli Cyril Ramaphosa. UHlabisa uwachaze njengosomathuba amaqembu afake isiphakamiso sokungabethembi ubuholi bukaRamaphosa. Ukusho lokhu ngesikhathi ekhuluma nabeNewzroom Afrika. Amaqembu iMKP ne-ATM afake isiphakamiso sokungabethembi ubuholi bukaRamaphosa. UMENGAMELI Cyril Ramaphosa La maqembu afake isiphakamiso sokungabethembi ubuholi bukaRamaphosa emva kokuba iNkantolo yoMthethosisekelo ichithe isinqumo sePhalamende sokunqaba ukwamukela umbiko wethimba elalijutshwe ukuba liphenye ngokuntshontshwa kwezishaqane zamadola aseMelika epulazini likaRamaphosa. UHlabisa uthe asikho isidingo sokuthi kulalelwe isiphakamiso sokungabethembi ubuholi bukaRamaphosa, wathi kufanele kulandelwe imiyalelo yenkantolo. ""Emva kwesinqumo senkantolo sakhipha isitatimende. Sikholwa wukuthi kufanele kulandelwe umthetho njengoba naye uRamaphosa eshilo ukuthi asihloniphe isinqumo senkantolo. IPhalamende kufanele lenze lokho okushiwo yisinqumo senkantolo. Akukuhle ukuba usomathuba. Asikho isidingo sesiphakamiso sokungabethembi ubuholi bukaRamaphosa. Kunesinqumo senkantolo esishoyo ukuthi yiluphi uhlelo okufanele lulandelwe. Thina njenge-IFP asibona abantu abathanda ukubukwa. Siyavumelana ngokuthi kufanele kulandelwe imiyalelo yenkantolo."" USomlomo wePhalamende, uNkk Thoko Didiza, ubengakasiphenduli isicelo se-MKP nese-ATM. Phezu kwesicelo se-MKP ne-ATM kuphinde kube nesicelo se-EFF efuna ukuthi iPhalamende lisungule ngokushesha ikomiti elizoqhuba uhlelo lokukhipha uRamaphosa esikhundleni. Umholi we-EFF, uMnuz Julius Malema, uthe uRamaphosa uzolahlekelwa okuningi uma ekhishwa esikhundleni ngohlelo abaluhlongozayo. ""Uma ukhishwa ngalolu hlelo ulahlekelwa imihlomulo etholwa ababengomengameli. Lapha sibala impesheni, izimoto kanye nabasebenzi onikezwa bona uma usuthatha umhlalaphansi."" UMalema uthe bazolwa nemizamo kaRamaphosa yokubambezela uhlelo lokuthi akhishwe esikhundleni. Kuvela ukuthi uRamaphosa angase aye enkantolo eyophonsela inselelo umbiko wekomiti elalijutshwe yiPhalamende ukuba liphenye lolu daba. ""Noma angaya enkantolo sizoya nathi enkantolo. Sizothi lolu daba luyaphuthuma, alulalelwe ngokushesha. Uma ecabanga ukuthi uzosibambezela, uqambe eshilo. Sizofaka isicelo sokuthi udaba lulalelwe ngokushesha. Uzobizwa ukuba azoziphendulela."" Ukuze uRamaphosa akhishwe esikhundleni ngalolu hlelo kufanele isiphakamiso sivotelwe u-66% wamalungu ePhalamende. UMHOLI we-EFF, uMnuz Julius Malema UMalema uthe abanandaba noma singachithwa ekugcineni isiphakamiso sokuthi uRamaphosa akhishwe esikhundleni ngoba bazobe sebemhlambalaze bamqeda ngesikhathi evele phambi kwekomiti elizobe liqhuba uhlelo lokuthi akhishwe esikhundleni. ""Asinandaba nokuthi uyakhishwa yini esikhundleni. Indaba yokuvota isekugcineni. Kuyothi kufikwa lapho uRamaphosa uyobe esehlambalazeke waphela. Kuningi okuzovela. Sizombiza ezoziphendulela sibize nabasebenzi basepulazini. Kuningi okuzovela. Abasebenzi bazositshela iqiniso. Ngiyazi ukuthi kwakungekhona okokuqala bentshontsha imali lapha. Maningi amagama abantu abazovela. Uzombuleka izinqe."""
Sabelo Nsele,https://www.isolezwe.co.za/izindaba/2026-05-12-umalema-uthi-usezingeni-likamandela-nosisulu/,"UMHOLI we-EFF, uMnuz Julius Malema UMHOLI we-EFF, uMnuz Julius Malema, uthi ukuboshelwa kwakhe icala lokuqhumisa isibhamu kumenza abe sezingeni lezingqalabutho ze-ANC ezaboshelwa amacala ezepolitiki abala kuzo owayengumengameli wokuqala ngaphansi koMbuso wentando yeningi, uMnuz Nelson Mandela, owayengumholi we-ANC, uMnuz Oliver Tambo, kanye nowayengunobhala jikele we-ANC, uMnuz Walter Sisulu. UMalema uthe uma kuwukuthi ugcinwa ngempela ephoqiwe ukuthi akayodonsa isigwebo ejele kuyomele aboshwe ejele elisesiqhingini okwakugcinwe kulo uMandela nezinye izishoshovu, iRobben Island. Ukusho lokhu ngesikhathi ekhuluma emcimbini wethimba lentsha ye-EFF elijutshwe ukuba liqhube umkhankaso wokhetho lohulumeni basekhaya. UMalema wagwetshwa iminyaka emihlanu ebhadla ejele ngecala lokuqhumisa isibhamu. Usiphonsela inselelo isigwebo sakhe. Uthe ngeke ehle esikhundleni ngoba elahlwe icala lezepolitiki. ""Ngiboshelwe icala lezepolitiki. Ngiboshelwe into engayenza eqenjini lezepolitiki. Uma befuna ukungibopha kufanele bavule iRobbeni Island. Ngeke ngiyogqunywa nezigebengu ejele. Angisona isigebengu. Mina ngisezingeni loMandela, Sisulu noTambo. Angiyena utsotsi. Mina abangibambanga ngintshontsha, angibulalanga muntu. Ngenza into ephathelene nepolitiki emcimbini weqembu lezepolitiki. Manje bafuna ukungibophela lokho."" UMalema uthe labo abafuna aboshwe bafuna ukumvala umlomo. ""Abafuni ukuthi ngiqhubeke nokukhuluma iqiniso ngoba abezwani neqiniso."" UMalema uthe uzoqhubeka nokulwa noma angaboshwa. Unxuse intsha ukuba iphume ngezinkani iyobhalisela ukuvota njengoba kuzokuba nokhetho lohulumeni basekhaya ngoNovemba. Kuzokuba nempelasonto yokubhalisela ukuvota ngenyanga ezayo. Intsha yakuleli ayimandla ekuvoteni. UMalema uthe ukuvota kwentsha okhethweni oluzayo kungenza ukuthi amaqembu amadala angaliboni elidlalayo. ""Uma kuwukuthi uyaqaphela kahle i-ANC, DA ne-IFP abayingeni eyokunxenxa abantu ukuthi babhalisele ukuvota. Ingoba bafuna kungabi noshintsho ohlwini lwabantu ababhalisele ukuvota."" UMalema uthe intsha kufanele isukumele izinkinga ezibhekene nemiphakathi yayo. ""Akufanele nigcine kuphela ngokuba izishoshovu ezikhungweni zemfundo ephakeme kuphela. Kufanele nisukumele izinkinga ezikhungethe imiphakathi yangakini ngoba uma niyocasha ezikhungweni zemfundo ephakeme nizozifica zinilindile lezi zinkinga emakhaya uma seniqedile ukufunda."""
Sabelo Nsele,https://www.isolezwe.co.za/izindaba/2026-05-11-angiyi-ndawo-ramaphosa/,"UMENGAMELI weZwe uMnuz Cyril Ramaphosa USAZOQHUBEKA nokuqhoqhobala isikhundla uMengameli Cyril Ramaphosa, oveze ukuthi uzophonsela inselelo umbiko wethimba elalijutshwe iPhalamende ukuba liphenye ngokuntshontshwa kwezishaqane zamadola aseMelika epulazini lakhe iPhala Phala. URamaphosa uveze ukuthi uzonikela enkantolo eyophonsela inselelo lo mbiko owathola ukuthi kungenzeka ukuthi kukhona okufanele akuphendule ngalolu daba. Ukusho lokhu ngesikhathi ethula inkulumo, ngoMsombuluko ebusuku. IPhalamende lawuchitha umbiko wethimba elaliholwa yijaji eselathatha umhlalaphansi, uSandile Ngcobo. Kepha ngoLwesihlanu iNkantolo yoMthethosisekelo ichithe isinqumo sePhalamende sokunqaba umbiko wethimba. URamaphosa uthe uyasihlonipha isinqumo senkantolo kodwa wathi umbiko wethimba elalijutshwe iPhalamende unamaphutha. ""Nginqume ukuphonsela inselelo umbiko wethimba. Angikwenzi lokhu ngoba nakhu ngingalihloniphi ikomiti kodwa ngenza lokhu ngoba ngikholelwa ukuthi kunamaphutha embikweni wethimba."" URamaphosa uthe umbiko wethimba ugcwele izinto ezingenabufakazi. ""Inzwabethi yonke lena equkethwe umbiko wethimba."" URamaphosa uthe angeke ashiye esikhundleni. ""Kukhona abathi angisule esikhundleni. Akukho lapho khona inkantolo ethe nginecala. Ngizimisele ukuqhubeka ngihole abantu baseNingizimu Afrika. Muningi umsebenzi osangihlalele."""
Sabelo Nsele,https://www.isolezwe.co.za/izindaba/2026-05-11-uyihlomise-wayibhekisa-kuzuma-umholi-we-da-ekzn/,"UMHOLI we-DA KwaZulu-Natal, uMnuz Sithembiso Ngema Image: Facebook/ DA KZN UMHOLI omusha we-DA KwaZulu-Natal, uMnuz Sithembiso Ngema, uyihlomise wayibhekisa kowayengumengameli, uMnuz Jacob Zuma, neqembu lakhe iMKP. UNgema uthe ufuna ukuthi baqinise kakhulu umkhankaso wabo wokhetho lohulumeni basekhaya ngakubo kaZuma, eNkandla. Ukusho lokhu ngesikhathi ethula inkulumo engqungqutheleni yokukhetha ubuholi be-DA KwaZulu-Natal, ebingempelasonto. UNgema oyikhansela kuMasipala waseThekwini, wehlule ilungu lePhalamende, uMnuz Mzamo Billy, embangweni wokuhola i-DA KwaZulu-Natal. UNgema uthe amanzi avele asengenile endlini kuZuma njengoba sebenomholi obamele esikhungweni semfundo ephakeme esiseNkandla. ""Sizokwenza isiqiniseko sokuthi siyakhula eNkandla. Kade ngikhuluma nosihlalo we-DA eNkandla, ngamtshela ukuthi kufanele sibe nabantu abazongenela ukhetho lwamakhansela khona."" UNgema uthe abayesabi nakancane iMKP eyafika kwezwakala okhethweni lukazwelonke lwango-2024. ""Siyazi ukuthi kukhona iqembu elisha elifaka izikibha ezimhlophe, singangalo."" UNgema uthe ayikho indawo abangeke bakhankase kuyo lapha KwaZulu-Natal. ""Sizokhankasa kuzo zonke izindawo zaKwaZulu-Natal, sizokhankasa kubona bonke omasipala. Kulabo abahambe bethi siyinhlangano ebandlululayo, abaqhubeke nokusho njalo kodwa thina sizoqhubeka nokuhambisa izidingo kubantu. Abanye babethi i-DA ayisoze iphathe lapha KwaZulu-Natal. Buka namhlanje sinabaphathiswa kuhulumeni waKwaZulu-Natal futhi siphethe uMasipala waseMngeni."" UNgema uthe ufuna iqembu likhule kuzona zonke izindawo. Uthe bazoqhubeka nokukhuluma namakhosi nezinduna ukuze baqinisekise ukuthi iqembu liyakhula ezindaweni zasemakhaya. UNgema ukhulume ngobunzima kuhulumeni wokubambisana ophethe KwaZulu-Natal abayingxenye yawo kodwa wathi bazoqhubeka nokuyibamba ishisa kuhulumeni ababambisene kuwo ne-IFP, ANC neNFP. ""Siyazi ukuthi kunezinkinga kuhulumeni wesifundazwe. Abasimele esiShayamthetho bayaqhubeka nokufuna izimpendulo kubaholi be-ANC. Ukuthi sibambisene ne-ANC akusho ukuthi sekufanele siyeke lokho esikholelwa kukhona."" Abanye abaholi abaqokelwe ezikhundleni uNgqongqoshe wezeMisebenzi yoMphakathi, uMnuz Dean Macpherson, oqokelwe kwesikaSihlalo, kwathi uMphathiswa wezeMsebenzi yoMphakathi, uMnuz Martin Meyer, waqokelwa kwesePhini lomholi. Abaqokelwe kwesePhini likasihlalo yiPhini leMeya kuMasipala waseMngeni, uMnuz Sandile Mnikathi, ilungu lesiShayamthetho, uMnuz Sakhile Mngadi, nomxhumanisi we-DA neNdlunkulu kaZulu, uMnuz Swelakhe Shelembe."
Sabelo Nsele,https://www.isolezwe.co.za/izindaba/2026-05-11-uhlabisa-nomyalezo-oshubile-kwabanqaba-izikibha-ezinobuso-bakhe/,"UMHOLI we-IFP, uMnuz  Velenkosini Hlabisa ABAHOLI be-IFP okuthiwa abezwani, okunguMengameli weqembu, uMnuz Velenkosini Hlabisa noSihlalo weqembu KwaZulu-Natal, uMnuz Thami Ntuli, bakhulume ngezwi elilodwa, bekhuza uqhekeko iqembu lethula umkhankaso wokubhalisela ukhetho lohulumeni basekhaya. UHlabisa noNtuli baxwayise ngokuthi labo abadala uqhekeko bazophazamisa umkhankaso wokhetho lohulumeni basekhaya. Bakusho lokhu ngesikhathi beshiyelana inkundla emcimbini obuseMpangeni. UHlabisa uhlabe wahlikiza labo abathi ngeke bazigqoke izikibha ezinobuso bakhe kanye nalabo abathi ngeke besazigqoka izikibha ezinobuso bomsunguli weqembu, Inkosi Mangosuthu Buthelezi. Amalungu e-IFP asanda kunikezwa ilungelo lokuba agqoke izikibha ezinobuso bukaHlabisa kodwa kunamalungu eqembu angafuni ukufaka izikibha ezinobuso bukaHlabisa. Kusanda kusabalala inkulumo yelungu leqembu, uNksz Lindi Ndlovu, lapho lithi ngeke lisigqoke isikibha esinobuso bukaHlabisa ngesikhathi likhuluma nelungu lesiShayamthetho elingusihlalo wophiko lwentsha kwi-IFP KwaZulu-Natal omisiwe, uMnuz Mncedisi Maphisa. UHlabisa uthe ukuba uButhelezi usekhona ubezokuba owokuqala ukugqoka isikibha esinobuso bakhe. Image: Independent Newspapers Archives UHlabisa uthe uButhelezi wayefuna ukuthi kube nezikibha ezinobuso bakhe ngesikhathi kubhekwe okhethweni lwango-2019. Ngaleso sikhathi uHlabisa wayengakabi umholi weqembu, wayemele i-IFP embangweni wesikhundla sikandunankulu waKwaZulu-Natal. ""Ngathi Shenge angikabi umholi weqembu, asikwazi ukuba nezikibha ezinobuso bomuntu ongeyena umholi weqembu. Ngathi asisebenzise ubuso obaziwa abantu."" UHlabisa uthe nangokhetho lohulumeni basekhaya lwango-2021, uButhelezi waphinda wenza isicelo esifanayo kodwa bamchitha ngenxa yokuthi umkhankaso wokhetho wasuke waphazanyiswa ukubheduka kobhubhane iCorona. ""Ngaphambi kokhetho lwango-2024, uMntwana waphinde wenza isicelo esifanayo. Ngebhadi ke wabe esekhothama. Sabe sesinquma ukuthi siqhubeke nokusebenzisa ubuso bakhe okhethweni lwango-2024, njengendlela yokuqhakambisa amagalelo akhe. ""Umuntu othi yena akasezokusigqoka isikibha soMntwana ngoba uthanda uHlabisa, ungumkhohlisi. Umuntu othi yena wethembeke kuMntwana, akazekusigqoka isikibha sikaHlabisa, ungumkhohlisi. UMntwana wathi uzokuba owokuqala ukugqoka esikibha esinobuso bukaHlabisa. Wena ngapha uhamba utshela abantu ukuthi angeke usigqoke isikibha esinobuso bukaHlabisa."" UNtuli uthe asikho isidingo sokuthi amalungu e-IFP alwe wodwa ngoba iqembu linomholi oyedwa okunguHlabisa, wanxusa onke amalungu eqembu ukuthi aseke uHlabisa. ""Kubaluleliile ukuthi sonke seseke umengameli emsebenzini wakhe. Asikwazi ukwehlukana. Sinomholi oyedwa, asinabo abaholi ababili. SinePhini likamengameli elilodwa, asinawo amaphini kamengameli amabili. SinoSihlalo waKwaZulu-Natal oyedwa, asinabo osihlalo baKwaZulu-Natal ababili. ""Ngiyafisa ukugcizelela lokhu. Njengoba siya okhethweni, uma silibele ukuklwebhana sodwa azosehlula amanye amaqembu. Uma silibele ukwehlukana, azosehlula amanye amaqembu. Noma ubani ohola umkhankaso wokwehlukanisa iqembu loyo muntu uyisitha seqembu. Noma ngabe ubani osebenzela ukugxeka umengameli weqembu, usihlalo waKwaZulu-Natal, noma imuphi umholi weqembu, loyo muntu uyisitha sobumbano lwe-IFP."""
Sabelo Nsele,https://www.isolezwe.co.za/izindaba/2026-05-11-ngabe-ufa-luyisiqalo-sesiphetho-se-ifp/,"Umsunguli we-IFP, Inkosi Mangosuthu Buthelezi UFA olubonakala kwi-IFP kufanele lubakhathaze abaholi beqembu. Iqembu elinezinhlangothi ezimbili ezibangayo lijwayele ukuba inyoka ezidla yona. Uma abaholi be-IFP bengakukholwa lokho abobuza kwi-ANC. I-ANC ilahlekelwe amandla nje namhlanje kungenxa yemibango yangaphakathi. Ngesikhathi i-ANC iya engqungqutheleni yokukhetha ubuholi yango-2007 kwakunezinhlangothi ezimbili, olweseka uJacob Zuma, nolwalweseka uThabo Mbeki. Sekuwumlando ukuthi kwanqoba uZuma nokwalandela ukuthi ababeseka uMbeki bahlubuke beyoqala inhlangano entsha, iCongress of the People. Umphumela wokuhlubuka kwabeseka uMbeki kwaba ukuthi kwehle ukweseka kwe-ANC okhethweni lwango-2009. Ezingqungqutheleni zokukhetha ubuholi be-ANC ezilandele eyango-2007 kuhlezi kunezinhlangothi ezimbili ezibangayo. Abasohlangothini oluhlulwayo bayaye behlubuke beqale amanye amaqembu njengoba i-ANC isizele amaqembu afana ne-EFF ne-MKP. Umphumela wokuhlubuka kwala maqembu uzwakale kakhulu kwi-ANC okhethweni lwango-2024 njengoba yahluleka ukuthola amavoti anele ukubusa ngokuzimela kuzwelonke nasezifundazweni iKwaZulu-Natal neGauteng. Abaholi be-IFP isike yabashaya le nduku Ngesikhathi owayengusihlalo we-IFP, uNkk Zanele kaMagwaza-Msibi, esungula iNFP, i-IFP yalahlekelwa inqwaba yomasipala okhethweni lohulumeni basekhaya lwango-2011. I-IFP yasala nomasipala ababili nje kuphela. Uma abaholi be-IFP bengabhekile ingase ibaphinde le nduku. Sekunesikhathi eside ikhulunyelwa phansi eyoqhekeko kwi-IFP. Mumva nje nengane encane isiyabona ukuthi kunomfantu onqabayo ukuvaleka nodalwa abathile abafuna ubuholi obehlukile ngaphakathi kwi-IFP. Lokhu kugqame kakhulu ngesikhathi kusabalala inkulumo eqoshiwe ephehla udlame yelungu lesiShayamthetho saKwaZulu-Natal elinguSihlalo woPhiko lwentsha kwi-IFP KwaZulu-Natal, uMnuz Mncedisi Maphisa. Kule nkulumo uMaphisa ukhuluma nelungu le-IFP, uNksz Lindi Ndlovu, elizwakala lithi ngeke lisigqoke isikibha esinobuso bomholi weqembu, uMnuz Velenkosini Hlabisa. Kule nkulumo uNksz Ndlovu ukhala ngokubanjwa ngophondo kohlangothi lwabo emhlanganweni yokugcotshwa kwamaziko. Yile nkulumo efakazela ukuthi kunezinhlangothi ezimbili ezinezifiso ezingefani. UNksz Ndlovu uzwakala ethi abaholi abasohlangothini lwabo bavinjwa nangamatshe emigwaqweni ukuze bengayi emihlanganweni yokugcotshwa kwamaziko. UMaphisa uphendula ngokuthi akufanele abasohlangothini lwabo bavume ukudlala abasohlangothini ababanga nalo. UMaphisa uze asho nokusho ukuthi kufanele bashaywe, 'bafokofiswe', labo abasohlangothini ababanga nalo. UMaphisa noNkk Ndlovu bamisiwe njengoba bebhekene nekomiti lokuqondiswa ubugwegwe. Akuyona eyokuqala inkulumo eqoshiwe esike yasabalala. Phambilini kuke kwasabalala enkulumo eqoshiwe okukholakala ukuthi kuyo kukhuluma usomlomo woMasipala waseNewcastle, uMnuz Thengi Zulu. Kule nkulumo lomuntu okukholakala ukuthi uZulu uzwakala ecija itulo lokuthi bazoludlisela kanjani ogageni uhlangothi ababanga nalo emihlanganweni yokugcotshwa kwamaziko. Kusukela umsunguli weqembu osakhothama, Inkosi Mangosuthu kaMathole Buthelezi, wabeka phansi izintambo ngo-2019, ibilokhu ikhulunyelwa phansi eyezinhlangothi ezibangayo kwi-IFP. Kunezinhlangothi ezimbili ezibhekene ngeziqu zamehlo olunye olubizwa ngama-AU (abusekho ubunzima) kanye nelibizwa ngamaKKK (konke kuhamba kahle). Ama-AU kuthiwa ahamba noHlabisa ama-KKK wona kuthiwa afuna kukhishwe uHlabisa esikhundleni. Izimpi zangaphakathi kwi-IFP zigqame kakhulu emva kokukhothama kukaButhelezi ngo-2023 futhi sekubona ngisho nengane encane ukuthi inkulu inkinga lapha. Iphini lomholi we-IFP, Inkosi Mzamo Buthelezi, lisanda kuxwayisa ngokuthi iqembu alikulungele ukubhekana nomonakalo ozodalwa ilaba abagqugquzela uqhekeko eqenjini. Ikhuluma emcimbini obuseNquthu, Inkosi ithe baqala into abangeke bayimele laba abagqugquzela ukwehlukana eqenjini. ""Le nto yethu yokuthi sibhekane sodwa izosilimaza kakhulu. Nginganitshela mina ngingabazi ukuthi njengeqembu asikulungele ukubhekana nomphumela wale nto esiyiqalayo. Angiphinde nginichazele, njengeqembu asikakasawoti ukuze sikwazi ukubhekana nalokhu esikuqala manje ukuba sikukhande. Ngamanye amanye amagama le nto yokuthi sibhekane sodwa, silwe sodwa, izosishaya isibhuqe nya. Siyophaphama ngakusasa kungekho kwalezihlalo esinazo."" Emlandweni wayo weminyaka engu-51 i-IFP ayikaze ibhekane nezimpi zalolu hlobo. Umhlaziyi wezepolitiki waseNyuvesi yaKwaZulu-Natal, uMnuz Zakhele Ndlovu, uthe akwethusi ukubona izimpi zangaphakathi ezifufusa kwi-IFP. ""UMntwana uyena umuntu obeyibambile, ubeyinomfi. Siyazi ukuthi ukukhethwa kukaHlabisa akuhambisananga nenqubo ejwayelekile. UMntwana nje owakhomba uHlabisa. I-IFP ibanjwe isikhathi eside uMntwana, kunguyena oyi-glue. Njengoba engasekho ayisekho leyo glue ebiyihlanganisile."" UNdlovu uthe okunye okudala uqhekeko kwi-IFP ukuthi sekunezikhundla kuhulumeni. ""I-IFP isemandleni komasipala, kuhulumeni waKwaZulu-Natal, nakuhulumeni kazwelonke. Izikhundla zizobangwa ngoba wonke umuntu ufuna isinkwa. Kukhona abantu abangajabule ngenxa yokuthi bona abazitholanga izikhundla."" UMENGAMELI we-IFP leader uMnuz Velenkosini Hlabisa Image: Leon Lestrade / Independent Media"
Sabelo Nsele,https://www.isolezwe.co.za/izindaba/2026-05-11-liloliwe-izembe-kuramaphosa-ngolwasephala-phala/,"AMAQEMBU aphikisayo alolela izembe uMengameli Cyril Ramaphosa, kulandela isinqumo seNkantolo yezoMthethosisekelo esivuse upelepele ogqokweni ngodaba lokuntshontshwa kwezishaqane zamadola aseMelika epulazini lakhe iPhala Phala. Amaqembu amabili asefake isiphakamiso sokungabethembi ubuholi bukaRamaphosa, kuneqembu lesithathu lona elifuna kusungulwe ngokushesha ikomiti elizoqhuba uhlelo lokukhipha uRamaphosa esikhundleni. Amaqembu i-MKP, EFF ne-ATM abhalele uSomlomo, uNkk Thoko Didiza. Nakuba izicelo zala maqembu zingafani kodwa onke afuna ukuthi uRamaphosa adliwe yizembe. I-MKP ne-ATM bafuna kulalelwe ngokushesha isiphakamiso sokungabethembi ubuholi bukaRamaphosa. I-EFF yona ifuna kusungulwe ngokushesha ikomiti elizoqhuba uhlelo lokukhipha uRamaphosa esikhundleni. Lolu hlelo oluhlongozwa yi-EFF luhlukile kunesiphakamiso sokungabethembi ubuholi. Umholi okhishwa ngaphansi kwalolu hlelo akayitholi imihlomulo yakhe okubalwa nempesheni njengoba kwenzeka kowayeyinhlomo yamajaji eWestern Cape, uDkt John Hlophe, nowayengumvikeli womphakathi, u-Advocate Busisiwe Mkhwebane. Uhlelo oluhlongozwa yi-EFF luyaye luthathe isikhathi njengoba kuba nezigcawu zokulalelwa kwezethulo lapho osuke esuswa esikhundleni enikwa ithuba lokuziphendulela. Uma kunesiphakamiso sokungamethembi umengameli kuyaye kube nempikiswano ePhalamende, bese kuyavotwa. Okungaphinde kubambezele uhlelo oluhlongozwa i-EFF ukuthi uRamaphosa aphonsele inselelo umbiko wethimba lasePhalamende elaliholwa yijaji eselathatha umhlalaphansi, uSandile Ngcobo, owathola ukuthi kungenzeka ukuthi kukhona uRamaphosa okufanele akuphendule ezinsolweni zokuthi awabikelwanga amaphoyisa ngokuntshontshwa kwemali epulazini lakhe. URamaphosa wake wazama ukuwuphonsela inselelo umbiko kodwa wabuye wayeka ngenxa yokuthi iPhalamende lawuchitha. Njengoba isinqumo sangoLwesihlanu sesibuyisele umbiko ezithebeni zePhalamende, kungeza uRamaphosa abuyele enkantolo. USihlalo we-EFF onguSotswebhu weqembu ePhalamende, uNkk Nontando Noluntshungu, ubhalele uNkk Didiza ecela ukuba kusungulwe ikomiti ngokushesha. UNkk Noluntshungu uthe isinqumo senkantolo siqede nya umbango obukhona ngalolu daba. Unqumele uNkk Didiza umnqamulajuqu wezinsuku ezimbili ukuba aqinisekise ukusungulwa kwekomiti. ""Uma singayitholi impendulo kulesi esisibekile, uze wazi ukuthi sinelungelo lokukuthathela izinyathelo zomthetho. Lolu daba selubambezeleke kakhulu. Asifuni kuphinde kube nokubambezeleka."" Umholi weMKP ePhalamende, uHlophe, uthe abasabuthembi ubuholi bukaRamaphosa. UHlophe uthe bafuna ukuthi isiphakamiso sokungabethembi ubuholi bukaRamaphosa silalelwe lingakashoni elangoLwesithathu. UHlophe nomholi we-ATM, uMnuz Vuyo Zungula, bathe bafuna ukuthi kuvotwe ngokuyimfihlo esiphakamisweni sokungabethembi ubuholi bukaRamaphosa. Ubuholi be-ANC KwaZulu-Natal buzwakalise ukumeseka uRamaphosa. Umdidiyeli wethimba elihola i-ANC KwaZulu-Natal, uMnuz Mike Mabuyakhulu, uthe isinqumo senkantolo asisho ukuthi uRamaphosa unecala. Amaqembu abambisene ne-ANC kuhulumeni wokubambisana, okubalwa kuwo iDA ne-IFP. awazange afune ukusho ukuthi azophikisana yini nokuthi kukhishwe uRamaphosa esikhundleni. La maqembu ame ngelokuthi kufanele kulandelwe umthetho."
