author,url,text
Sabelo Nsele,https://www.isolezwe.co.za/izindaba/2026-05-18-elasephalamende-lihleli-izithonto-umasipala-wasethekwini/,"IKOMITI lasePhalemende elibhekelele ukusebenza kwemali yomphakathi lihlezi imbashalala uMasipala waseThekwini ngezinsolo zenkohlakalo, ukuqasha ngokwenzelela ophikweni lwamaphoyisa omkhandlu nezinsolo zocansi ezibhekiswe kwimenenja yomkhandlu. Ikomiti libhalele iMeya yomkhandlu, uMnuz Cyril Xaba, licela ukuba ichaze ngalezi zinsolo kanye nezinye. IMEYA yeTheku, uMnuz Cyril Xaba UMasipala weTheku kulindeleke ukuthi uphekwe ngebhodwe elincane uma usuvele phambi kwekomiti ukuzochaza ngalezi zinsolo. Encwadini ebhalwe usihlalo wekomiti, uMnuz Songezo Zibi, ikomiti licele ukuba uXaba achaze kabanzi ngezinsolo zenkohlakalo ekuqashweni kwamaphoyisa kamasipala. Ngo-2024, kwasuka umsindo ngesikhathi kuqashwa amaphoyisa kamasipala angu-500 emva kokuthi owesifazane wabonga wanconcoza kunobhala wegatsha le-ANC athi waba nesandla ekutheni kuqashwe umzukulu wakhe. UZibi ucele uXaba ukuba achaze ngophenyo olwenziwe ngalezi zinsolo. ""Sicela uchaza ukuthi yiziphi izinhlelo ezikhona zokuqinisekisa ukuthi akubi khona ukwenzelela uma kuqashwa?"" UZibi ucele uXaba ukuba alethe umbiko ogcwele ngezinsolo zocansi ezibhekene nomenenja yomasipala, uMnuz Musa Mbhele, ezenziwa yiPhini lemenenja yomkhandlu, uNksz Kim Makhathini. ""Iyiphi inkampani eyaqashwa ukuba iphenye izinsolo? Ubani owaqasha le nkampani futhi yabiza malini? Ngabe ukhona omunye umsebenzi le nkampani eyake yawenza lapha emkhandlwini? Ubani owagunyaza ukuqashwa kwayo?"" Image: RSA Parliament UZibi uyalele uXaba ukuba achaze ngokuqashwa kukankosikazi wesikhulu sezezimali emkhandlwini, uDkt Sandile Mnguni. ""Imiphi eminye imisebenzi ake wayenza lapha emkhandlwini? Obani abagunyaza ukuqashwa kwakhe?"" Ikomiti lifuna ukwazi ukuthi obani abanikazi bamaloli amanzi aqashwe umkhandlu. ""Ngabe imalini asebekhokhelwe yona kule minyaka emihlanu eyedlule?"" Ikomiti lifuna ukwazi ngokubambezeleka kohlelo lokwakhiwa kwezindlu eNanda olubizwa ngeNamibia 8 Housing Project. Lolu hlelo lwezigidi zamarandi lwaqala ngo-2019. Ikomiti liyalele umkhandlu ukuba uchaze ngohlelo lokufakwa kwengqalasizinda yokuthuthwa kwendle olwaqala ngo-2019. ""Iluphi uhlelo olwalandelwa ngesikhathi kukhishwa ithenda yalo msebenzi? Kungani izinkampani zingakaze zikhokhelwe? Yini eyenze ukuthi uhlelo lubambezeleke? Ngabe luzoqedwa nini lolu hlelo?"" Ikomiti licele uXaba ukuthi achaze ngo-R60 million owabhubhudlwa ngonyakamali owedlule. UXaba uyalelwe ukuba aphendule le mibuzo namhlanje. Okhulumela uXaba, uMnuz Mluleki Mntungwa, uthe bayitholile incwadi kaZibi kodwa wathi ngeke aphawule ngezinto okubuzwa ngazo kule ncwadi. UMntungwa uthe ubuholi bomkhandlu buzophendula kahle ngalezi zinto emhlanganweni abazokuba nawo namalungu ekomiti. ""Engingakusho nje ukuthi sizokuba nomhlangano namalungu ekomiti kuleli sonto. Angikwazi ukungena kulezi zinto okubuzwa ngazo kule ncwadi."""
Sabelo Nsele,https://www.isolezwe.co.za/izindaba/2026-05-18-imvunge-oxoshwe-kwi-ifp-egixabezwa-ngesikhundla-kwi-nfp/,"no NFP new member4.jpg UMNZ Sipho Mbatha Image: NQOBILE MBONAMBI SEKUQUBUKE imvunge kwi-NFP kulandela amahlebezi okuthi osanda kuxoshwa yi-IFP kwesobukhansela, uMnuz Sipho Mbatha, ugixabezwe ngesikhundla esibalulekile kuleli qembu eligubuzelwe izimpi zangaphakathi. Amalungu eqembu anganelisekile akhala ngokunikwa kukaMbatha isikhundla sikaNational Organizer. Amahlebezi okuthi uMbatha unikwe isikhundla abhebhetheke emva kokuba kusabalale incwadi okuthiwa ibhalwe uyena lapho azisa khona amalungu eNFP ngomcimbi ozohanjelwa umholi weqembu, uMnuz Ivan Barnes. Kule ncwadi uMbatha uzibiza ngo-National Organizer. UMbatha usanda kuxoshwa ekubeni ikhansela le-IFP kuMasipala wesifunda iKing Cetshwayo. UMbatha waxoshelwa izinsolo zokuthi ubenobulungu bamaqembu amabili kanye nezinsolo zokugwazisa abantu ayebathembisa umsebenzi namathenda kwamasipala. Amalungu anganelisekile athe ukunikwa kukaMbatha isikhundla kuphambene nemigomo yeqembu. Ilungu elicele ukuba igama lalo lingadalulwa lithe imigomo yeNFP ikubeka kucace ukuthi umuntu kufanele abe ilungu leqembu iminyaka emihlanu ngaphambi kokuthi anikwe isikhundla. ""Kazi kuyoze kube nini izikhundla zinikwa abantu abafikayo eqenjini? UMbatha asimazi nokuthi ujoyine nini njengoba esenikwa isikhundla. Mina ngamgcina eyikhansela le-IFP ngiyathuka namhlanje uma sengizwa kuthiwa usenikwe isikhundla esikhulu kangaka. Ingoba bebengekho yini abanye abantu abebengaqokwa?"" Umholi uthe uMbatha washiya onile kwiNFP njengoba esenikwa isikhundla nje. ""Ngesikhathi iNFP iphuma kwi-IFP, saphuma naye. Wasishiya simanxebanxeba, waphindela kwi-IFP. Namhlanje uzonikwa isikhundla. Kaze uzobenza njani labantu ashiye ebaqolile kwi-IFP?"" Omunye umholi uthe ukunikwa kwabantu izikhundla ngendlela engaqondakali kwenza ukuthi amalungu eqembu aphelelwe umdlandla. ""Icobana amathambo le ndaba yabantu abanikwa izikhundla ngendlela engaqondakali futhi yenza ukuthi kube nzima ukuthi amalungu eNFP abamukele. Nabo nje abasebenzi ngokukhululeka ngoba basuke belandelwa izinkulumo."" Unobhala jikelele weNFP, uMnuz Sunset Xaba, uthe abakaze bamqoke uMbatha. UXaba uthe bayibonile incwadi okuthiwa ibhalwe uMbatha kodwa wathi abazi ukuthi ubenikezwe ubani igunya lokuthi ayibhale. ""Akayena u-organizer wembu. Thina u-organizer esinaye uBawinile Mhlongo. Asikaze simqoke loyo Mbatha, angimazi nangokumbona. Angimazi ukuthi ubethunywe ubani ukuthi abhale leyo ncwadi."" UXaba uthe uMbatha wayephethe lesi sikhundla ngesikhathi kusekhona umsunguli weqembu, uNkk Zanele kaMagwaza-Msibi. Imizamo yokuthola ukuphawula kukaMbatha ayizange iphumelele njengoba ucingo lwakhe belukhala lungangeni futhi engazange ayiphendule imibuzo ayithunyelwe."
Sabelo Nsele,https://www.isolezwe.co.za/izindaba/2026-05-14-olunye-utwayi-kuramaphosa-ngephala-phala/,"UMENGAMELI Cyril Ramaphosa UMENGAMELI, Cyril Ramaphosa, uvulelwe elinye icala elithinta udaba lokuntshontshwa kwezishaqane zamadola aseMelika epulazini lakhe iPhala Phala. I-ActionSA ivulele uRamaphosa icala imsola ngokuthi waqamba amanga ngesikhathi edalula isamba semali eyalahleka epulazini lakhe. USotswebhu we-ActionSA, uNkk Lerato Ngobeni, uthe kunobufakazi obukhomba ukuthi inkulu kakhulu imali eyantshontshwa kunalena eyashiwo uRamaphosa. URamaphosa wadalula ukuthi kwantshontshwa u-580 000 wamadola aseMelika, nokusho ukuthi imali elinganiselwa ku-R10 million uma ibuyiselwa emalini yakuleli. UNkk Ngobeni uthe ubufakazi bakamumva bukhomba ukuthi imali eyantshontshwa ayikho ngaphansi kuka-R15 million. UNkk Ngobeni uthe kungavela okushaqisayo ngesamba semali eyantshontshwa uma kungase kuqhubeke kuphenywe. ""Siyiqaphelile imibiko ethi iNational Prosecuting Authority (NPA) nayo ishaya amakhala ngesamba esalahleka. INPA iqale ukushaya amakhala emva kokuphenya ngemali eyayiphuma ingena kwi-akhawunti yomunye wabantu ababoshelwe ukuntshontsha imali epulazini likaRamaphosa. Kuningi okungavela uma kungase kuphenywe ngemali eyangena neyaphuma kuma-akhawunti abanye abasolwa."" URamaphosa uvulelwe icala lokwehluleka ukubika ngobugebengu, elokuqamba amanga efungile kanye nelenkohlakalo. Udaba lokuntshontshwa kwemali epulazini likaRamaphosa luqale phansi emva kwesinqumo seNkantolo yoMthethosiseklo sangesonto eledlule. Inkantolo yachitha isinqumo sePhalamende sokunqaba ukwamukela umbiko wethimba elalijutshwe ukuba liphenye ngokuntshontshwa kwamadola aseMelika epulazini likaRamaphosa. Umbiko wethimba elaliholwa owayeyiJaji, uSandile Ngcobo, wathola ukuthi kungenzeka ukuthi kukhona imigomo uRamaphosa ayiphula. Isinqumo senkantolo sesenze ukuthi iPhalamende liqhubeke nohlelo lokukhipha uRamaphosa esikhundleni. Amaqembu ezepolitiki afuna uRamaphosa akhishwe esikhundleni. Amalungu esigungu esiphezulu kwi-ANC abenomhlangano oyisipesheli, izolo ebusuku lapho ebhunge khona ngalolu daba. Amalungu amaningi e-ANC ayameseka uRamaphosa kodwa kukhona afuna ukuthi ehle esikhundleni."
Sabelo Nsele,https://www.isolezwe.co.za/izindaba/2026-05-14-umatlala-angase-ashaye-ungqimphothwe-ecaleni/,"KWESOKUNXELE, nguMnuz Vusimuzi 'Cat' Matlala obewukhumbintethe namaphoyisa asolwa nawo ecaleni lethenda yezigidi zamaradi ayeyithole kwiSAPS. Kuvela ukuthi uMatlala angase alivume leli cala awumshungu kulo noMkhuzi wamaPhoyisa onikwe ikhefu, uGeneral Fannie Masemola ANGASE alivume icala usomabhizinisi, uMnuz Vusimuzi ""Cat"" Matlala, oboshwe kanye noKhomishana wamaPhoyisa omisiwe, uGeneral Fannie Masemola. UMbuso uveze ukuthi kunezingxoxo eziqhubekayo ezingaholela ekutheni uMatlala avume icala elithinta ithenda yezigidi zamarandi eyanikwa inkampani yakhe. UMatlala, Masemola namanye amaphoyisa angu-12 athinteka ekukhishweni kwethenda ka-R360 million, bavele kafushane eNkantolo yeMantshi ePitoli, izolo. Icala labo lihlehliselwe uJune 26, ukuze kuqedelwe uphenyo. Abameli bakaMatlala bacele inkantolo ukuba ikhiphe umyalelo wokuthi uMatlala aqhubeke nokugcinwa ejele elisePitoli, iKgosi Mampuru II, esikhundleni sokubuyiselwa ejele eliKwaZulu-Natal, iBongweni. Abameli bakaMatlala bathe ukugcinwa kwakhe eKgosi Mampuru II kuzokwenza ukuthi kube lula ukuthi balungiselele icala ngenxa yokuthi ijele liseduze nalapho kuqulwa khona icala. Umshushisi, u-Advocate Santhos Manilall, uthe abaphikisani nesicelo sabameli bakaMatlala. UManilall uthe ukugcinwa kukaMatlala eKgosi Mampuru II kuzokwenza ukuthi kube lula ukuqhubeka nezingxoxo. ""Izingxoxo sezifinyelele kwesinye isigaba, kungenzeka siqale izingxoxo zokuthi uMatlala avume icala. Kungaba kuhle kakhulu uma engaqhubeka atoke eKgosi Mampuru."" Okhulumela inhlangano yezokushushisa, iNational Prosecuting Authority (NPA), uMnuz Kaizer Kganyago, uthe kunobufakazi obusha ababutholile ngalolu daba. ""Sifuna ukuqinisekisa lobu bufakazi obusha esibutholile. Sifuna ukubheka kahle izitatimende zokusebenza kwezimali."" UMatlala uphinde abhekane noxhaxha lwamacala okukhona kuwo nawokuzama ukubulala. Igama likaMatlala livela ezinsolweni ezenziwa uKhomishana wamaPhoyisa KwaZulu-Natal, uLieutenant General Nhlanhla Mkhwanazi. Bekumatasa ezinkantolo izolo, amacala athinta abantu amagama abo avela phambi kweKhomishini eholwa yiJaji Mbuyiseli Madlanga. Usomatekisi odumile, uMnuz Joe ""Ferrari"" Sibanyoni, uvele kafushane eNkantolo yeMantshi eKwaggafontein, eMpumalanga, izolo. USibanyoni uboshelwe icala lokufuna ngodli imali kusomabhizinisi. Ekhuluma nabezindaba, uSibanyoni uthe umsulwa. ""Ngiyinceku kaNkulunkulu mina."" USibanyoni uthe uzoshumayela ivangeli ejele njengoba eboshiwe. Uboshwe kanye noMnuz Mvimbi Masilela noMnuz Philemon Msiza. Icala labo lihlehliselwe uLwesihlanu. Imenenja kaMasipala waseKurhuleni, uMnuz Kagiso Lerutla, nesikhulu sophiko lwamaphoyisa omkhandlu esimisiwe, uMnuz Julius Mkhwanazi, bavele kafushane eNkantolo yeMantshi eBoksburg. ULerutla noMkhwanazi babhekene namacala enkohlakalo, ukukhwabanisa nokuphazamisa ukusebenza kwengalo yomthetho. Icala labo lihlehliselwe uJuni 9. Umholi weqembu iNational Coloured Congress, uMnuz Fadiel Adams, ubevele eNkantolo yeMantshi ePinetown. U-Adams ubhekene necala lokuphazamisa ukusebenza kwengalo yomthetho. Izolo uqhubekile nokufaka isicelo sebheyili, icala lahlehliselwa uLwesihlanu."
Sabelo Nsele,https://www.isolezwe.co.za/izindaba/2026-05-14-ungizwe-nenselelo-ngabokufika-kwabe-anc-abebezomkhalisa/,"OWAYENGUMSAKAZI oKhozini, uNgizwe Mchunu, uphonsele inselelo ubuholi be-ANC eThekwini, ukuba bulalele abantu bakuleli abakhala ngabokufika abangekho emthethweni. UMchunu uthe abaholi kufanele basukumele izikhalazo zabantu abalwa nabokufika abakuleli abangekho emthethweni. Ukusho lokhu ngesikhathi ubuholi be-ANC esifundeni iTheku, buzomkhalisa kulandela ukungqongqiswa komuzi wakhe oseMbumbulu. Umuzi kaMchunu uthungelwe ngomlilo ngeSonto, kanti ukushiswa kwawo kusolwa ukuthi kuhlobene nemibhikisho yokulwa nabokufika, njengoba uMchunu engomunye wabantu abaphambili kule mibhikisho. Utshele abaholi be-ANC esifundeni iTheku ukuthi abantu bakuleli sebekhathele abakufika abakuleli ngokungemthetho. ""Siyanicela baholi ukuthi nisilalele. Ngiyazi ukuthi izindlebe zenu ziyaphuza ukuzwa kodwa ngiyacela ukuba nisilalele. Le nto esiyenzayo lapha inokuthula. Siyazi ukuthi nonke nina baholi bezepolitiki niyaphuza ukuzwa."" Abaholi be-ANC abebeyokhalisa uMchunu bebeholwa ongumdidiyeli we-ANC eThekwini ophinde abe uSomlomo kuMasipala waseThekwini, uMnuz Thabani Nyawose. UMchunu uphonsele uNyawose inselelo ukuba asukumele umonakalo odalwa ngabantu bokufika edolobheni eThekwini. ""Baba ngiyazi ukuthi ngelinye ilanga ungase ube yimeya kamasipala njengoba nibekana ngale ndlela enibekana ngayo. Awukwazi ukwenza sengathi awuyiboni le nto eyenzeka edolobheni eThekwini. Amabhilidi angcolile. Abantu bokufika bagwazela izikhulu zoMnyango wezaseKhaya. Bagwazela wonke umuntu."" UMchunu uthe kuyamjabulisa ukuthi i-ANC eThekwini isanda kukhipha isitatimende lapho ithe iyayeseka imibhikisho elwa nabokufika abakuleli ngokungemthetho. UNyawose uthe i-ANC ayinawo umgomo wokuvikela abantu bokufika abakuleli ngokungemthetho. ""Abantu abangena emngceleni yethu bengenawo amaphepha abagunyaza ukuthi bangene eNingizimu Afrika, i-ANC iyakugxeka lokho. Lena imfundiso nje eqhutshwa abantu abafuna ukuveza i-ANC njengenhlangano ephambana nehlombe, engasabalaleli abantu."" UNyawose uthe bayakugxeka ukushiswa komuzi kaNgizwe, wathi banethemba lokuthi amaphoyisa azobathola ngokushesha abasolwa. I-ANC inikele ngevawusha ka-R10 000 yokuthenga izimpahla zokwakha."
Sabelo Nsele,https://www.isolezwe.co.za/izindaba/2026-05-13-luselude-ukhalo-lokukhishwa-kukaramaphosa-ungoti/,"Umengameli Cyril Ramaphosa Image: File/IOL graphics UNGOTI wezomthetho ubona lulude ukhalo oluzohanjwa njengoba uMengameli Cyril Ramaphosa, ememezele ukuthi uzophonsela inselelo umbiko wethimba elalijutshwe iPhalamende ukuba liphenye ngokuntshontshwa kwezishaqane zamadola aseMelika epulazini lakhe, iPhala Phala. Ungoti weDonda Attorneys, uMnuz Melusi Xulu, uthe uhlelo lokukhipha uRamaphosa esikhundleni lungase lunyomfe ukufakwa kwesicelo esiphonsela inselelo umbiko wethimba elaliholwa owayeyijaji, uSandile Ngcobo. UXulu uthe uRamaphosa angase afake isivimbelo esizonqanda ukuqhubeka kohlelo lwasePhalamende lokumkhipha esikhundleni. URamaphosa umemezele ukuthi uzophonsela inselelo umbiko owathola ukuthi kungenzeka ukuthi kukhona imithetho ayephula ekusingathweni kodaba lokuntshontshwa kwemali epulazini lakhe. Enkulumweni abeyibhekise ezweni, uRamaphosa uveze ukuthi ngeke asule esikhundleni. URamaphosa uthe uyasihlonipha isinqumo senkantolo kodwa wathi umbiko wethimba elalijutshwe iPhalamende unamaphutha. ""Nginqume ukuphonsela inselelo umbiko wethimba. Angikwenzi lokhu ngoba nakhu ngingalihloniphi ikomiti kodwa ngenza lokhu ngoba ngikholelwa ukuthi kunamaphutha embikweni wethimba."" URamaphosa uthe umbiko wethimba ugcwele izinto ezingenabufakazi. ""Inzwabethi yonke lena equkethwe umbiko wethimba."" UXulu uthe kungase kuthathe isikhathi eside ukuthi inkantolo inqume esicelweni esizofakwa uRamaphosa. ""Kungathatha izinyanga noma unyaka. Ukhumbule ukuthi uma icala ezolifaka enkantolo enkulu, uma kuwukuthi akuhambi ngendlela afisa ngayo kungenzeka adlulele enkantolo yamacala adlulisiwe. Angaze afike eNkantolo yoMthethosisekelo. Uzokhumbula ukuthi isicelo se-EFF salalelwa ngo-2024 kodwa isinqumo size saphuma ngo-2026. Ngakho ke kunzima ukusho ukuthi icala lizothatha isikhathi esingakanani."" UXulu uthe uhlelo lokukhipha uRamaphosa esikhundleni luzoqhubeka uma engasifaki isivimbelo senkantolo. ""Uma engasifaki isivimbelo senkantolo bazoqhubeka nabakwenzayo. Kuzomele asifake isicelo sokuvimba ukuqhubeka kohlelo lokumkhipha esikhundleni. Uma engakwenzi lokho uzothi eqhubeka enkantolo nabo bebe beqhubeka ngapha."" Amaqembu ezepolitiki afuna ukuthi luqhubeke uhlelo lokukhipha uRamaphosa esikhundleni yize ephonsela inselelo umbiko wethimba. Okhulumela i-IFP, uMnuz Mkhuleko Hlengwa, uthe iPhalamende kufanele liqhubeke nomsebenzi walo. ""Uhlelo lokukhipha uMengameli esikhundleni luwumsebenzi wePhalamende okungafanele umiswe ukuthi kunecala elifakiwe. Kufanele uhlelo luqhubeke kanye necala."" Okhulumela i-EFF, uMnuz Sinawo Thambo, uthe bebevele bekulindele ukuthi uRamaphosa uzophonsela inselelo umbiko. ""Akananembeza. Silindele ukuthi uSomlomo (uNkk Thoko Didiza) asiphikise isicelo sikaRamaphosa. Nathi sizosiphikisa isicelo sikaRamaphosa. Yini emenze ukuthi alinde isikhathi eside ukuthi aphonsele inselelo isinqumo senkantolo. IPhalamende kufanele liqhubeke nezinhlelo zalo. Izinhlelo zePhalamende akufanele zimiswe isicelo sikaRamaphosa."""
Sabelo Nsele,https://www.isolezwe.co.za/izindaba/2026-05-13-ikhuthaza-imfundo-kozakwabo-imeya-ethweswe-iziqu/,"UMNUZ Melikhaya Ngcongo IBONA ukufunda kwezimeya kungaba yikhambi elingaqeda idimoni lokungalandelwa kwemigomo komasipala baKwaZulu-Natal iMeya kaMasipala waseRichmond esanda kuthweswa iziqu zemfundo ephakeme, uMnuz Melikhaya Ngcongo. UNgcongo uthe ukuncipha kwezimeya ezingaziboni izimpukane kuzokwenza ukuthi banciphe nomasipala abathola imibiko enogcobho. Ukusho lokhu engxoxweni abe nayo neSolezwe. UNgcongo usanda kuthweswa iziqu iPost Graduate Diploma in Public Management eNyuvesi yasePitoli. Umasipala awuphethe wenza kahle kakhulu ekuphathweni kwemali njengoba uyingxenye yomasipala abane baKwaZulu-Natal abathole imibiko engenagcobho ngonyaka odlule. Bekungunyaka wesibili umasipala uthola umbiko ongenawo ugcobho, kanti lona ngunyaka wesithathu uNgcongo esesihlalweni. UNgcongo uthe kuba lula ukuthi izikhulu zizenzele umathanda uma imeya ingayazi imithetho eyengamele ukusetshenziswa kwemali. ""Uma uyimeya uwena ongusihlalo wekomiti lezezimali kumasipala. Uma imeya ingaziboni izimpukane kuzokonakala. Izikhulu zizozenzela umathanda. Ngeke sifunde sonke siyizimeya, kodwa labo ithuba elisavuma kubona kufanele baye kofunda. Uma uwumholi kufanele uwazi umsebenzi wezikhulu zomasipala kanye nemithetho ethinta ukuphathwa kwemikhandlu. Ugcina uvuma noma izikhulu sezenza izinto ezingalungile uma ungayazi imithetho."" UNgcongo uthe izimeya kufanele ziqinisekise ukulandelwa kwemithetho uma zifuna ukuthola imibiko engenagcobho. ""Ngeke uwuthole umbiko ongenagcobho uma ungathembekile. Kufanele uqashe abantu abawaziyo umsebenzi. Omasipala abaningi bathola imibiko enogcobho ngenxa yokuthi abayilandeli imigomo uma besebenzisa imali. Inkinga enkulu ilapha ophikweni okukhishwa kulo amathenda."" UNgcongo uthe usaphokophele ukuthola ezinye iziqu zemfundo ephakeme. ""Uma uwumholi kubalulekile ukuthi uzithuthukise ngolwazi. Ngesikhathi ngiqokelwa ukuphatha umasipala ngo-2023 ngabona ukuthi kuningi engingakwazi mayelana nokuphathwa komasipala kanye nokusetshenziswa kwemali yomphakathi."" UNgcongo uthe uyaqhubeka nezifundo zakhe njengoba manje esenza iMasters. Ebuzwa ukuthi ngabe ufisa ukufinyelela eziqwini zobudokotela yini uthe uzofinyelela uma iNkosi ivuma. UNgcongo uthe bekungelula ukuqhuba iziqu zemfundo ephakeme. ""NgesiZulu nje ngingathi ibingitibulisa, namanje ngisaqhubeka nokutibula ngoba ngisaqhubeka nokufunda. Akulula ukucaza isikhathi sakho njengoba bengifunda ngisebenza. Ukuzimisela kwami yikhona okwenze ukuthi ngigcine ngiphumelela."""
Sabelo Nsele,https://www.isolezwe.co.za/izindaba/2026-05-12-kushone-obemele-i-da-embangweni-wesobumeya/,"UMNUZ Christo Botha obemele i-DA embangweni wesikhundla sobumeya kuMasipala waseMhlathuze KUSHONE obemele i-DA embangweni wesikhundla sobumeya kuMasipala waseMhlathuze, uMnuz Christo Botha. UBotha, obeyiphini lemeya kuMasipala waseMhlathuze, ushone emva kokuxinwa ukugula. Izindaba zokushona kwakhe zimenyezelwe ngumholi we-DA KwaZulu-Natal, uMnuz Sithembiso Ngema. UNgema uthe bagqemeke engeqiwa ntwala ngokushona kukaBotha. ""Asilahlekelwanga nje iphini lemeya kodwa silahlekelwe umholi obesebenzela abantu. Uyena obezomela i-DA embangweni wesikhundla sobumeya eMhlathuze njengoba kuza ukhetho lohulumeni basekhaya. Angeke siwakhohlwe amagalelo akhe kuMasipala waseMhlathuze  nokulwela kwakhe abantu baseMhlathuze."" UBotha ubephinde abe yikhansela lakuWard 2. USomlomo womkhandlu, uMnuz Tobias Gumede, unxuse abantu abahlala kuWard 2 abadinga usizo lomkhandlu ukuba bathinte ihhovisi lakhe namalungu ekomiti lekhansela kuWard 2 ukuze ezothola usizo. UGumende udlulise amazwi enduduzo emndenini kaBotha."
Sabelo Nsele,https://www.isolezwe.co.za/izindaba/2026-05-12-uhlabisa-uphikisa-isiphakamiso-sokungamethembi-uramaphosa/,"UMHOLI we-IFP, uMnuz Velenkosini Hlabisa Image: Leon Lestrade / Independent Media UMHOLI we-IFP, uMnuz Velenkosini Hlabisa, uthe ngeke baseseke isiphakamiso sokungabethembi ubuholi bukaMengameli Cyril Ramaphosa. UHlabisa uwachaze njengosomathuba amaqembu afake isiphakamiso sokungabethembi ubuholi bukaRamaphosa. Ukusho lokhu ngesikhathi ekhuluma nabeNewzroom Afrika. Amaqembu iMKP ne-ATM afake isiphakamiso sokungabethembi ubuholi bukaRamaphosa. UMENGAMELI Cyril Ramaphosa La maqembu afake isiphakamiso sokungabethembi ubuholi bukaRamaphosa emva kokuba iNkantolo yoMthethosisekelo ichithe isinqumo sePhalamende sokunqaba ukwamukela umbiko wethimba elalijutshwe ukuba liphenye ngokuntshontshwa kwezishaqane zamadola aseMelika epulazini likaRamaphosa. UHlabisa uthe asikho isidingo sokuthi kulalelwe isiphakamiso sokungabethembi ubuholi bukaRamaphosa, wathi kufanele kulandelwe imiyalelo yenkantolo. ""Emva kwesinqumo senkantolo sakhipha isitatimende. Sikholwa wukuthi kufanele kulandelwe umthetho njengoba naye uRamaphosa eshilo ukuthi asihloniphe isinqumo senkantolo. IPhalamende kufanele lenze lokho okushiwo yisinqumo senkantolo. Akukuhle ukuba usomathuba. Asikho isidingo sesiphakamiso sokungabethembi ubuholi bukaRamaphosa. Kunesinqumo senkantolo esishoyo ukuthi yiluphi uhlelo okufanele lulandelwe. Thina njenge-IFP asibona abantu abathanda ukubukwa. Siyavumelana ngokuthi kufanele kulandelwe imiyalelo yenkantolo."" USomlomo wePhalamende, uNkk Thoko Didiza, ubengakasiphenduli isicelo se-MKP nese-ATM. Phezu kwesicelo se-MKP ne-ATM kuphinde kube nesicelo se-EFF efuna ukuthi iPhalamende lisungule ngokushesha ikomiti elizoqhuba uhlelo lokukhipha uRamaphosa esikhundleni. Umholi we-EFF, uMnuz Julius Malema, uthe uRamaphosa uzolahlekelwa okuningi uma ekhishwa esikhundleni ngohlelo abaluhlongozayo. ""Uma ukhishwa ngalolu hlelo ulahlekelwa imihlomulo etholwa ababengomengameli. Lapha sibala impesheni, izimoto kanye nabasebenzi onikezwa bona uma usuthatha umhlalaphansi."" UMalema uthe bazolwa nemizamo kaRamaphosa yokubambezela uhlelo lokuthi akhishwe esikhundleni. Kuvela ukuthi uRamaphosa angase aye enkantolo eyophonsela inselelo umbiko wekomiti elalijutshwe yiPhalamende ukuba liphenye lolu daba. ""Noma angaya enkantolo sizoya nathi enkantolo. Sizothi lolu daba luyaphuthuma, alulalelwe ngokushesha. Uma ecabanga ukuthi uzosibambezela, uqambe eshilo. Sizofaka isicelo sokuthi udaba lulalelwe ngokushesha. Uzobizwa ukuba azoziphendulela."" Ukuze uRamaphosa akhishwe esikhundleni ngalolu hlelo kufanele isiphakamiso sivotelwe u-66% wamalungu ePhalamende. UMHOLI we-EFF, uMnuz Julius Malema UMalema uthe abanandaba noma singachithwa ekugcineni isiphakamiso sokuthi uRamaphosa akhishwe esikhundleni ngoba bazobe sebemhlambalaze bamqeda ngesikhathi evele phambi kwekomiti elizobe liqhuba uhlelo lokuthi akhishwe esikhundleni. ""Asinandaba nokuthi uyakhishwa yini esikhundleni. Indaba yokuvota isekugcineni. Kuyothi kufikwa lapho uRamaphosa uyobe esehlambalazeke waphela. Kuningi okuzovela. Sizombiza ezoziphendulela sibize nabasebenzi basepulazini. Kuningi okuzovela. Abasebenzi bazositshela iqiniso. Ngiyazi ukuthi kwakungekhona okokuqala bentshontsha imali lapha. Maningi amagama abantu abazovela. Uzombuleka izinqe."""
