author,url,text
Fanelesibonge Bengu,https://www.isolezwe.co.za/ezemidlalo/ezezimoto/2026-04-20-kwakia-baphaka-impi-kwiranger-nehilux-ngeveni-labo-itasman/,"I-Kia Tasman entsha ishiya abantu abaningi behlukene phakathi ngendlela ebukeka ngayo BASUKELE isidleke sezinyosi kwaKia South Africa ngokwethula iveni labo lokuqala ngqa, iTasman, ababheke ukuzuza lukhulu ngalo. Umphumela kuyoba wukuthi zibatinyele okanye bafinyelele ekhekheni kube wuju lodwa. Izinyosi kulokhu yizingqungqulu ezikhonya emkhakheni wamaveni angama-double cab okuyi-Ford Ranger, Toyota Hilux, Isuzu D-Max, VW Amarok, GWM P-Series, Nissan Navara ne-Foton Tunland. Ngeke ubasole ngokuzama ukufika ojwini kwazise iconsisa amathe le makethe njengoba nyakenye kudayiswe ama-double cab angaphezu kuka-63 000. Uqala nje unyaka u-2026, evile ku-10 000 asefinyelele emakhasimendeni. Uma betinyeleka bazobe belandela ezinyathelweni zeMercedes-Benz ngeveni labo iX-Class eyayisuselwe kwiNissan Navara eyabhacaza baze bayihoxisa. Nokho iTasman ayifani neX-Class ngoba yona ayisuselwe ndawo, kunalokho kwaKia bayakhe kusuka phansi kuya phezulu. Ivele okokuqala emehlweni abantu ngo-2024 kwasuka okukhulu ukukhuluma ngendlela ebukeka ngayo. Namanje lokho kukhuluma akukapheli kusashiya abantu bengundaza ngezizathu ezingefani. Ngingomunye obeshaya amakhala kodwa emuva kokuyizwa ngezami izandla izinsukwana eWestern Cape ngesikhathi yethulwa, ngigcine sengingenankinga ngayo. Nabanye kungenzeka bajike umqondo uma sebeyijwayela. Ukuba le moto ingumuntu mhlawumbe beyizophiwa igama lokuthi uBuhlebuyeza. Ibukeka njengemoto encane okanye iSUV ngaphakathi iKia Tasman Okwamanje ezweni kukhona angu-150 futhi esinye isitokwe samaTasman angu-300 sisendleleni. Lokhu kukhombisa ngokusobala ukuzimisela kwabo ngokunyusa isibalo sezimoto abazidayisayo nonyaka, ngokusho kwesikhulu sakwa-Kia South Africa, uPaul Turnbull. Nyakenye badayise izimoto ezingu-18 843 nokuyisibalo esinyuke sisuka ku-14 103 ngo-2024. Ngo-2026, uTurnbull uthe bafuna ukudayisa ezingu-23 000 kuya phezulu. Ngale kweTasman, kunezinye izimoto ezintsha sha eziyisihlanu ezizayo nonyaka nezimbili ezinamagama asevele ekhona kuleli. Uma sibuyela kwiTasman, ngaphambili igolozile, iyagqama uma ithushuka. Iyagqama njengoba ubude bungu-5.410 mm kuthi ububanzi bube ngu- 1.930 mm. Ama-LED headlights ahlanganiswe nama-daytime running lights bawanameke ezinhlangothini bese ezansi kuba nama-fog lights. Ngikubone kuwabeka engcupheni yokulimala, ikakhulukazi uma usugudla ehlathini elithothene. Uma uyibuka ohlangothini kuvela amarimu angu-17 inch afakwe emasondweni angama-all terrain newindi langemuva elidimile. Kugqama amafenda aqumbile anombala omnyama okuthi uma uthanda uthole afana nombala ofana nomzimba wemoto. Esikhenkeni kunokokusivikela ukuthi singaklwebheki uma ulayishe impahla. Ngikuthandile ukuthi isivalo sesikhenke asisindi uma usivula noma usivala. Kuningi okunye ongakwengeza ngokuthanda kwakho njenge-bull bar, styling bar, i-roller shutter esikhenkeni kanjalo ne-towbar. I-towbar le ungakwazi ukudonsa ngayo isisindo esingu-3 500kg. ITasman ifika ngezinhlobo ezintathu okuyi-LX edonsa ngamasondo amabili, SX ne-X-Pro ezidonsa ngawo wonke. “Wu-last number” iX-Pro ebesihamba ngayo. Ngaphakathi ungafunga ukuthi yi-SUV. Inezihlalo zesikhumba, ezangaphambili okwazi ukuzifudumeza uphinde uzibandise. Okunye okokushisisa yisiteringi. Iphinde ibe ne-touchscreen infotainment system engu-12.3 inch ehlangene ne-digital instrument cluster. Phakathi nendawo kuwona la ma-screen kunesinye esincane esikukhombisa amazinga okushisa nokuthi umoya uphuma kuphi. Besingabonakali kahle ngasohlangothini lomshayeli kudingeka ngitshekise ikhanda ukulunguza. Kwi-infotainment udlala umculo ngezipikha ezikhala kamnandi ze-Harman Kardon, ikukhombisa lonke ingaphandle njengoba inamakhamera zinhlangothi zombili ngaphambili nangemuva, uxhuma iselula nge-Apple CarPlay/Android Auto ngaphandle kwentambo nokunye. Ngiyakuthanda ukuthi kunamabhathini asheshe akufikise kofuna ukukwenza ungathinti kwi-touchscreen ize ingcole. Ngibala inkinobho yokunyusa umsindo, ezokushintsha amazinga okushisa nokunye. Kunezimbobo ezimbili zokushaja nge-USB ngaphambili, eyokushaja ngaphandle kwentambo nezinye ezimbili zokushaja ngemuva. Ngemuva isikhala sabagibeli ngisibone sikahle, kuphela ezinyaweni sincanyana. ITasman ifika nenjini eyodwa engu-2.2 litre kadizili ekhona nakwezinye izimoto zakwa-Kia njengeSorento. Inamandla angu-154kW ne-torque engu-440Nm bese kuthi u-gearbox ube yi-8 speed automatic. Indlela isisuse eWaterfront yaze yayophelela eLambert’s Bay, bude buduze nasezweni elingumakhelwane iNamibia. Sigudle etiyeleni, sangena obhuqwini, saphinde sabuyela etiyeleni. Ngisanda kuyisusa ngiyizwe sengathi inokuthanda ukushintshashintsha amagiya kodwa sagcina sijwayelene. Ngemuva ifika nokokuvikela isikhenke iKia Tasman Amandla abezwakala enele uma isukuma futhi iyicela indlela uma ngifuna ukudlula ezinye izimoto namaloli ahudula izinqola ezilayishe impahla. Inama-drive modes amane okungu-Eco, Normal, Sport no-Tow. Ngaphakathi ithule futhi uma umgwaqo uqala ukuba mubi bekuzwakala kodwa hhayi ngendlela ekhalisayo. Ngeke nokho uyibeke ezingeni leRanger. Ngichazwe yindlela ebambelela ngayo okusizwa kakhulu wukuthi idonsa ngawo wonke amasondo amandlla iwafake lapho edingeka khona. Uma uthanda uyayishintsha idonse ngamabili bese kuthi uma ususobhuqwini uyifake ku-4H okanye u-4Low. Ngike ngayishiya ku-4 Auto obhuqwini ngayibona ilubamba kodwa ngiyizwa ne-traction control ingenelela ukungigcina endleleni. Obhuqwini ibingakhalisi nhlobo ingazweli kakhulu futhi ilinyusa nejubane ngale kokukuthusa ngokuthi ingakuphosa esikhotheni. Akukho lapho sixakeke khona kwadingeka ukuthi sisebenzise i-diff lock kwazise asiziqwalanga izintaba. Angiboni ukuthi ibizoshaya phansi ngoba igabade ilishiye ngo-252mm. Ikwazi nokuzihambela yona uma uyifaka kuX-Trek ongawufanisa ne-cruise control yasobhuqwini. Siphinde sayihloma esihlabathini, okuyindawo ekwazi ukuhamba kuyo ngale kokuxakeka. Esiteringini kunamabhathini okukutshela ukuthi uhamba endaweni enjani njengasesihlabathini, ematsheni nasodakeni Yona ibe isizilungisa ngendlela efanele njengokuthi ithi ukulibamba igiya esihlabathini. KwaKia bathi ngo-100km iphuza amalitha angu-7.8 litres ethangini elingu-80 litres. Ngilunguze ngayibona idla 8.9l/100km. Ngokwami iTasman yiveni elisezingeni nelingase licoshacoshe emakhasimendeni. Izinyanga ezizayo yizona ezizosidweba sicace isithombe sokuthi abashayeli baseNingizimu Afrika bahamba nayo noma bazoqhubeka nokubambelela ezintandokazini zabo iRanger, Hilux okulindeleke entsha maduze neD-Max ethuthukisiwe ezokwethulwa noma yinini. Kia Tasman 2.2D AT 4x2 LX                        R 679,995 Kia Tasman 2.2D AT 4WD SX                      R 879,995 Kia Tasman 2.2D AT 4WD X-PRO               R 999 995 Zifika ne-service plan yeminyaka eyisithupha noma u-90 000km, Roadside assistance weminyaka emihlanu engakalelwe banga ne-warranty yeminyaka emihlanu nayo engakalelwe banga."
Fanelesibonge Bengu,https://www.isolezwe.co.za/ezemidlalo/ezezimoto/2026-04-20-kuxwayiswa-ngobungozi-bokushayela-ugxile-kokunye/,"Kuqwashiswa ngobungozi bokuphazanyiswa okuthile ube ushayela nokungadala izingozi zomgwaqo U-EPHRELI uphawulwa njengenyanga yokuqwashisa abantu ngobungozi bokushayela kukhona okubaphazamisayo, nokuyinto okuthiwa ingenye yezimbangela ezinkulu zezingozi emgwaqweni. Isikhulu senkampani efundisa ukushayela futhi egqugquzela ukuphepha emgwaqweni iMasterDrive, u-Eugene Herbert, sithe imininingwane yezinkampani zemishwalense ikhomba ukuthi ukushayela bese kuba nokukuphazamisayo kwenyusa amathuba okushayisa ngo-60%. “Ngokwe-World Health Organisation, ukusebenzisa iselula ube ushayela kunyusa amathuba okushayisa ngokuphindwe kane. Lokhu kuhlanganisa ukuyibamba ngesandla nokusebenzisa iBluetooth. ENingizimu Afrika, iRoad Traffic Management Corporation (RTMC) ihlale ibalula ukuphazamiseka komshayeli njengokuphambili ezingozini okufa kuzo abantu. Kunzima ukuthola ulwazi oluqondile ngoba emuva kwengozi akulula ukusho kugcwale umlomo ukuthi ingozi idalwe wumshayeli obephazamisekile,” kusho uHerbert. Uthe ucwaningo lososayensi luthi kunzima ukuthi unganaka ngokugcwele izinto ezimbili kanye kanye. Kunalokho umqondo ulokhu ushintsha ngokushesha unaka izinto ozenzayo ngokwahlukana. “Kuleyo mizuzwana unganakile yonke into ingaphuma esandleni. Ngesivinini esingu-120km/h, imoto ihamba ibanga elilinganiselwa ku-33 metres njalo ngomzuzwana. Ukubuka iselula imizuzwana emine kuya kwemihlanu kufana nokuhamba ibanga enkundleni ye-rugby ucimezile,” kusho uHerbert. Uthe akuyona iselula kuphela kodwa nakhu okunye:"
Fanelesibonge Bengu,https://www.isolezwe.co.za/ezemidlalo/ezezimoto/2026-04-19-upanjaro-uvikele-isicoco-kwi-red-bull-shayimoto/,"UPANJARO elenga kwibhonethi imoto ibe iphenduka emncintiswaneni i-Red Bull Shay'iMoto Image: Craig Kolesky/Red Bull Content Pool USIVIKELE ngempumelelo isicoco sakhe uJean “Panjaro” Kruger emncintiswaneni i-Red Bull Shay’iMoto obuseSuncoast Casino, eThekwini, ngoMgqibelo ebusuku. Lo mncintiswano ubusubuya eThekwini okwesibili iminyaka ilandelana njengoba ubuqala ukuba khona nyakenye. Yilapho uPanjaro, ohlala eMahikeng, athatha khona isicoco kuBoksie waseKapa. Abashayeli banikezwa imizuzu emibili nohhafu wokuthi bashaye izidudla, bechushe nasezikhaleni, benze neminye imigilingwane ngemoto. Abanye baphuma imoto ihamba babuye bangene baqhubeke nokushayela. U-KING Tyler nomsizi wakhe benza abadume ngazo kwi-Red Bull Shay'iMoto Image: Mpumelelo Macu/Red Bull Content Pool UPanjaro uhehe izethameli elenga kwibhonethi evulekile imoto ibe ishaya isidudla. Konke abakwenzayo kumele kwenelise amajaji nezethameli nazo ezivotayo. NgoLwesihlanu ebusuku, umncintiswano uqale kunabashayeli abangu-16, kwase kuyiwa kowamanqamu ngoMgqibelo, sekusele abayisishiyagalombili. Abane abathole amaphuzu amaningi banikwe ithuba lokuzikhethela abafuna ukuqhudelana nabo. Bese kusele uPanjaro, Magesh Junior, Team VQ25, King Tyler, uBubu okunguye yedwa obemele iKwaZulu-Natal, King Kruger ongumfowabo kaPanjaro, Team 2xSpicy JZ noBemors. Uhlelo beluphethwe nguHope Mbhele nomakadebona kulo mdlalo, uVic Pardal. Ngokunqoba kabili kulandelana, uPanjaro ulandele ezinyathelweni zikaSam Sam obeyijaji okokuqala kulokhu. USam Sam wanqoba ngo-2021 nango-2022. UPanjaro ongandanga ngamazwi uthe: “Ngiyabonga kakhulu ngokungeseka, ngizonibona ngonyaka ozayo.”"
Fanelesibonge Bengu,https://www.isolezwe.co.za/izindaba/2026-04-17-icosatu-nenselelo-kuhulumeni-ngentela-kaphethroli/,"IZINKOMBA ziveza ukuthi ingase iphinde yenyuke intengo kaphethroli, udizili nopharafini ngenyanga ezayo Image:  Tumi Pakkies / Independent Newspapers UMFELANDAWONYE wezinyunyana zabasebenzi, iCosatu, uhlabe ikhwelo kuhulumeni ukuthi uphinde uqhamuke nezinye izindlela zokunciphisa ukuzwela kokunyuka kwentengo kaphethroli nodizili, okulindeleke ukuthi kwenzeke ekuqaleni kukaMeyi. Ekuqaleni kwenyanga intengo yelitha likaphethroli u-93 no-95 inyuke ngo-R3.06. Ekadizili u-500ppm inyuke ngo-R7.37 kwathi elika-50ppm lanyuka ngo-R7.51. Ilitha likapharafini linyuke ngo-R11.67. Lokhu kunyuka kwentengo kudalwe yimpi ephakathi kwe-Iran ne-Israel (ebambisene ne-United States of America). Iphazamise ukuthuthwa kukawoyela ongahluziwe eStrait of Hormuz. Uhulumeni wamemezela ukuthi uzokwehlisa isikhashana intela kaphethroli ngo-R3 isuka ku-R4.10 yaba ngu-R1.10 ilitha. Kudizili yehle isuka ku-R3.93 yaba ngu-R0.93 ilitha kule nyanga futhi kuzophinde kubuyekezwe ngezayo. Lokhu wathi kuzowulahlekisela ngo-R6 billion emnothweni. Uhulumeni ekhasini lawo kwi-X, uveze ukuthi ukunyuka kwentengo kawoyela nokushintshashintsha kwamandla erandi, kulindeleke ukuthi kunyuse intengo kaphethroli ezinyangeni ezizayo. ICosatu ithe imibiko yakamuva yeCentral Energy Fund, iveza ukuthi intengo yelitha likaphethroli ingase yenyuke ngo-R3, R10 elikadizili no-R7 kwelikapharafini. “Lokhu ngokunye ukushayeka emnothweni onyuka ngo-1% kule minyaka engaphezu kuka-10 nasempini yamazinga okungasebenzi aku-41.1%. I-International Monetary Fund isivele ikwehlisile ukuqagela kokunyuka komnotho ngo-2026, yakubeka ku-1% isuka ku-1.4%,” kusho iCosatu. Ithe ukwehliswa kwentela kaphethroli inyanga eyodwa yigxathu elihle kodwa kudingeka okunye ngokushesha. Ithe inovalo lokuthi abasebenzi nomnotho ngeke bakwazi ukumelana nokunye ukunyuka kwentengo kaphethroli, udizili nopharafini. “Udizili ubalulekile ezithuthini zomphakathi abasebenzi abathembele kuzo kanjalo nopharafini osetshenziswa yizinkulungwane zemindeni. Abasebenzi bavele bacwile ezikweletini, banakekela izihlobo eziyisikhombisa umsebenzi ngamunye, bachitha u-40% womholo wabo kwezokuthutha futhi ngeke bakwazi ukumelana nokunyuka kwentengo kaphethroli, kadizili nekapharafini.” ICosatu ithe kumele kuphinde kwehliswe intela kaphethroli nenye intela. Ibalule nokuthi kumele kuqhanyukwe nezindlela zokwehlisa intengo kapharafini. Okunye ithe wukuthi kwenziwe izithuthi zomphakathi zishibhe."
Fanelesibonge Bengu,https://www.isolezwe.co.za/ezokungcebeleka/osaziwayo/2026-04-17-umculi-ugqugquzela-ozakwabo-ukungenela-icomrades/,"UMCULI uSabelo Ngema ovivela ukugijima iComrades Marathon okokuqala ngoJuni UMCULI oyilungu leqembu i-Afrosoul ufuna ukugqugquzela ozakwabo ngokubaluleka kokuzivocavoca ukuze bagweme izifo. Uzokwenza lokhu ngokugijima iComrades Marathon okokuqala ngoJuni 14 nonyaka. USabelo Ngema uzoba ngomunye wezinkulungwane zabagijimi ezizosuka eThekwini, zilibangise eMgungundlovu, kulo mjaho ozoba ngoka-99 kulo nyaka. Lo mculi uzobe engaqali ukusebenzisa ukugijima ukuqwashisa abantu ngokubaluleka kokunakekela impilo njengoba ngonyaka odlule, yena nozakwabo bagijime besuka eThekwini baya ePort Edward, befundisa ngezifo zengqondo. “UNkulunkulu usidale ngendlela yokuthi akukho okungasihlula ukukwenza. Ngathi uma ngibona umkhulu omdala eqeda iComrades ngonyaka odlule, ngazitshela ukuthi nami ngifuna ukuzophonsela inselelo yokuthi ngiyiqede. Sengiwagijimile ama-marathon (42.2km), ngase ngithi ake ngizwe iComrades,” kusho uSabelo. Uthe ukugijima kuyamsiza empilweni nasemqondweni ngoba uyakhohlwa yizinkinga uma esemgwaqweni. “Uthi uma ugijima amabanga amade ubuye usuwakhe isitezi ngomqondo, usuthenge nezimoto. Ubuya namaqhinga amasha okuzithuthukisa, yingakho ngikuyamanisa kakhulu nezifo zengqondo ngoba ukhwantalala nengcindezi kuyaphela,” kusho yena. Uthe nasekhaya isimo siba ngcono uma ujima ngoba ukhwantalala nengcindezi, kusuke kuphansi. “Kuthina esiganelwe, ekhaya kumnandi. Umama uhlala ehleka futhi upheka kahle. Uma uyindoda uhlala ujabule, ungakhathazeki nangokuhamba imitholampilo yamadoda ngoba uba wuqanduqandu. Lokho ngezinye zezinto ezinhle ezenziwa ukujima ngoba umndeni uyabumbana,” kusho uSabelo oshadelwe wuzakwabo acula naye eqenjini, uThandeka Zulu. Uthe ugqugquzelwa kakhulu umculi we-kwaito ophinde abe wumfundisi, uKabelo Mabalane, osegijime iComrades izikhawu eziningi. Uqhube wathi baningi abanye njengoDJ Sndara, naye oseke wayigijima iComrades Marathon phambili. “Ngiyabasifela abafowethu esinabo emkhakheni wezokungcebeleka ukuthi bakujwayele ukuzivocavoca futhi behlise nasezinkanjini zikaFaro. Ngiyazi ukuthi ngizozwakala njengomuntu ozenza ngcono kodwa asisebenzise uphuzo njengento yenjabulo ngaleso sikhathi, hhayi ukuthi silusebenzise ngokweqile ngoba luzohlukumeza imizimba yethu. Asijimeni. Buka ubaba uHhashi Elimhlophe ukuthi uma esesteji, udlula izintwana ezincane.” Uthe ngokujima yena usehlale enomfutho singabi khona nesidingo sokusebenzisa izikhuthazi nokusiza impilo yakhe. “Ngiyakhumbula eminyakeni edlule uL’vovo ngesikhathi ewa esteji, ngaba ngomunye wabokuqala engaya ukuyomsiza. Ngiyambona manje ukuthi uyajima, okuyinto engikhuthazayo nami nengifisa ngathi bakhona nabanye abangafunda kuyo.” Uphethe ngokuveza ukuthi uzoqala amaqoqo okugijima ngalapho ehlala khona, eReservoir Hills ngenhloso yokukhuthaza nabanye."
Nonkululeko Nhlapo,https://www.isolezwe.co.za/izindaba/2026-05-16-kuphele-ukuphapha-kuboshwa-abebedlala-ngezulu-lezandla/,"Kuphele 'ukuphapha' kuboshwa abebedlala ngezulu lezandla Amaphoyisa aseNingizimu Afrika (SAPS) abophe amadoda amabili ayamaniswa nezibhamu abonakale kwi-video esakazwa ezinkundleni zokuxhumana lapho abesifazane bebonakala bedlala budedengu bephethe izibhamu. Emuva kokusabalala kwe-video, abeSAPS Gauteng Crime Intelligence baqale umkhankaso wokuthungatha abasolwa okuwaholele eTembisa, eGauteng, lapho abasolwa betholakale khona baboshwa. Izibhamu ezibonakale kuvidiyo zithathwe ngamaphoyisa kanti uphenyo lokuqala luveza ukuthi lezi zibhamu azinalayisensi. Ngesikhathi kuqhubeka lo mkhankaso abasolwa baphinde batholakala nemoto ebiduniwe. I-Gauteng Crime Intelligence iyaqhubeka nokuphenya ngabasolwa. Laba balisa ababili abaneminyaka engu-21 no-34 baboshelwe ukwephula umthetho iFirearms Control Act, ukutholakala nezibhamu ezingekho emthethweni nezinhlamvu kanye nokuba nemoto eduniwe. Amantombazane abonakala kule video agcine atholakele ngemuva kokuthi umkhondo wabasolwa ukhombe amaphoyisa lapho ahlala e-Ebony Park, eMidrand. Ngesikhathi amaphoyisa ebuza ngawo kuvele ukuthi abonwe namadoda aseNingizimu Afrika eshayela imoto emhlophe yohlobo lwe-VW Polo. Imoto ibe isivinjwa eduze kwaseKaalfontein, abesifazane ababili abebefunwa batholakale emotweni base beyiswa eTembisa South SAPS. Amaphoyisa aphinde axwayise amalungu omphakathi ngokuphatha budedengu kanye nokukhonjiswa kwezibhamu, ngoba lokho kubeka izimpilo zabantu engozini futhi kuyicala elinzima. Abasolwa kulindeleke bavele eNkantolo yeMantshi yaseTembisa ngesonto elizayo."
Nonkululeko Nhlapo,https://www.isolezwe.co.za/izindaba/2026-05-16-uzovela-ngelizayo-oboshwe-ephuma-kumadlanga/,"Kubikwa ukuthi zimkhalele ephuma kwikhomishini kaMadlanga uBrown Mogotsi. Image: Oupa Mokoena / Independent Newspapers Kubikwa ukuthi zimkhalele ephuma kwikhomishini uBrown Mogotsi ngoLwesihlanu ntambama. Kuthiwa uzovela eNkantolo yeMantshi yaseGoli ngoMsombuluko. UMogotsi uboshwe yithimba lamaphoyisa eSAPS ngesikhathi eshayela esuka ePitoli elibangise eGoli - cishe imizuzu engu-45 ephumile kwikhomishini, nalapho echithe cishe amahora amane ephekwa ngemibuzo. Ngesikhathi ethula ubufakazi, uMogotsi ubelokhu ephindelela ukuthi ubengafuni “ukuzifaka icala” ngesikhathi ecindezelwa ngumholi wobufakazi kanye namakhomishana ngezinto eziningi ezibalulekile. Amaphoyisa akuqinisekisile ukuthi kukhishwe incwadi egunyaza ukuboshwa kwakhe i-J50 ngokuphula umthetho. Ngokusho kwamaphoyisa, leli cala lisukela ecaleni lokuzama ukubulala uMogotsi eVosloorus ngoNovemba nyakenye. Abaphenyi bathi isigameko sokudubula sahlelelwa ngamabomu ukuze kwakhiwe isithombe sokuthi uMogotsi wayekhonjwe indlela."
Nonkululeko Nhlapo,https://www.isolezwe.co.za/izindaba/2026-05-16-kuboshwe-abathulwe-obethole-eyeraf/,"Kuthunjwe osanda kuthola ekaRAF Amaphoyisa KwaZulu-Natal ahlenge owesifazane owayethunjwe kanye nabanye abayisikhombisa ekhaya labo eChappies Section, eMandeville, eSundumbili, ngamadoda angaziwa ezintatha zangoLwesihlanu, 15 Meyi 2026. Izisulu eziyisikhombisa kubikwa ukuthi zidedelwe KwaDabeka ngemuva kwesikhashana, nokho owesifazane, osanda kuthola imali yakhe ye-Road Accident Fund (RAF), uyiswe endaweni engaziwa. Ithimba leProvincial Tracking Team lisebenze ngokuzikhandla lathola imoto eyodwa kwezimbili ezasetshenziswa ngesikhathi kuthunjwa, abopha abasolwa abathathu. Uphenyo luholele amaphoyisa ePhoenix lapho isisulu, esiseminyakeni yo-30 ubudala, sitholakale singenamyocu. Amaphoyisa anxusa abahlomuli be-RAF ukuthi bangazidaluli izinkokhelo zabo noma baziqhayise ngale mali. Abasolwa bazamile ukukhipha imali kaningi kodwa kwanhlanga zimuka nomoya, kodwa bakwazile ukuthenga ngemali elinganiselwa ku-R30 000. Abasolwa ababoshiwe bazovela enkantolo maduze. Kusathungathwa abanye abasolwa."
Nonkululeko Nhlapo,https://www.isolezwe.co.za/izindaba/2026-05-15-okwenzeke-ezinkantolo-namhlanje/,"1008617120__20260430__0 ULehlogonolo Chauke, odume ngelikaShebeshxt ULehlohonolo “Shebeshxt” Chauke (31) uvele okokuqala eNkantolo yesiFunda ePolokwane ngamacala okugebenga nokutholakala nezibhamu ezingekho emthethweni nokuzama ukubulala. Ubhekene namacala angu-20 esewonke, amanye awo inqwaba yokuzama ukubulala. Udaba luhlehliselwe umhla ka-28 Meyi 2026 ukuze kuvunyelwe umbuso ukuthi uqedele ukudalula okuqukethwe emadokodweni abekwe endaweni eyodwa. Umsolwa ugqunywe esitokisini kusukela aboshwa ngonyaka odlule. Uzohlala esitokisini. UFadiel Adams evele enkantolo yeMantshi ePinetown Image: Sibonelo Ngcobo/Independent Media Umholi weqembu lezepolitiki i-NCC nelungu lePhalamende, uFadiel Adams, unikezwe ibheyili ka-R10 000. Icala lihlehliselwe umhlaka-14 Agasti 2026 ukuze kuqhutshekwe nokuqhubeka. Njengengxenye yemibandela yebheyili, ummangalelwa uyalwa ukuba angaxhumani, ngokuqondile noma ngokungaqondile, nanoma ibaphi ofakazi boMbuso kanye/noma ukushushiswa. Ummangalelwa uyalelwa ukuba azibike mathupha eHhovisi Lamaphoyisa aseMitchells Plain Police Station phakathi kwehora le-06h00 no-20h00 njalo ngoLwesibili nangoMgqibelo, kusalindwe ukuphothulwa kwalolu daba. USOMATEKISI uJoe “Ferrari” Sibanyoni nasolwa nabo uMvimbi Daniel Masilela noPhilemon Msiza namhlanje bajoyinwe umsolwa wesine ozinikele emaphoyiseni uBafana Sindane. Namhlanje babuyele enkantolo yeMantshi eKwaggafontein, eMpumalanga icala lahlehliselwa uMsombuluko. Image: Oupa Mokoena / Independent Newspapers Abammangalelwa bepulazi lezidakamizwa eSwartruggens Babuyela esitokisini abammangalelwa anga-11, abatholwe epulazini elikhiqiza izidakamizwa eSwartruggens, eNorth West. Laba nammangalelwe abayisihlanu (5) badabuka eMexico, uFabian Astorga, Jesus Alonso, Medina Astorga, Luis Alberto Ramirez Rios, Jose Andres Medina, Jacquelin Lopez Madrid(owesifazane); abantu ababili (2) baseMozambique, u-Ismael Afiado Massinge, uLourenco Constantino Cumbane; oyedwa (1) ongowaseZimbabwe, uTobias Soyani kanye nezakhamuzi zaseNingizimu Afrika ezintathu (3), uTyron John Schutte, uKyle Schutte, uVusi Amos Mkambi."
Nonkululeko Nhlapo,https://www.isolezwe.co.za/izindaba/2026-05-15-kubi-kwababheke-ukuthola-amajezi-ebhola-ezingojeni/,"Amaphoyisa ashaqe impahla ongumbombayi eGoli I-SAPS e-Gauteng ishaqe izimpahla zomgunyathi ezibiza cishe u-R23m ngesikhathi somkhankaso wezinhlaka eziningi ohlose ukuqeda izimpahla eziwumkokotelo kanye nezingekho emthethweni endaweni edolobheni laseGoli ngoLwesihlanu. Lo mkhankaso ubudidiyelwe uphiko oluphenya izimpahla zomgunyathi lwaseGauteng ngokwesekwa ngamaphoyisa asemngceleni, Public Order Policing (POP), uphiko lwezobugebengu bezohwebo, abavikeli bemikhiqizo kanye nophiko lwezentela lwaseNingizimu Afrika (i-SARS). Impahla eshaqwe amaphoyisa enkabeni yedolobha eGoli Amathimba abomthetho abehamba ehlola amabhizinisi asenkabeni yedolobha ukuthi ayayithobela yini imithetho. Ngesikhathi kuqhubeka lo mkhankaso kuhanjelwe izitolo ezingu-23 zaseshwa nokuholele ekutheni kuthathwe izimpahla nezicathulo zomgunyathi ezingu-27 058. Impahla ezishaqiwr zenani elilinganiselwa ku-R23m. Ama-ejensi okuqinisekisa ukuthotshelwa komthetho azoqhubeka nokuqinisa imisebenzi yokuthobela kanye nokuphoqelela ukuthotshelwa kwemithetho kulo lonke elaseGauteng ukuze kuliwe nezenzo zobugebengu ezihlobene nezimpahla zomgunyathi nezingekho emthethweni. Amateki kanokusho awasalanga"
Nonkululeko Nhlapo,https://www.isolezwe.co.za/izindaba/2026-05-15-kudutshulwe-kwabulawa-abasolwa-ababili-esydenham/,"Kudutshulwe kwabulawa abantu ababili okusolwa ukuthi yizigebengu ebezihlomile ngesikhathi bedubulana namaphoyisa eSydenham ngoLwesine ntambama. Amaphoyisa azibonele isigameko sokugetshengwa kuBurnwood Road lapho abasolwa abathathu, abebeshayela iKia sedan emhlophe, bebegebenga owesilisa impahla yakhe. Abasolwa asukume abona ukuthi kukhona amaphoyisa, bashaya bachitha ngemoto. Ngesikhathi abasolwa bebaleka, omoto yabo ishayisane netekisi base beyishiya. Babaleke ngezinyawo bedubula bebhekise emaphoyiseni, kwadutshulwana. Abasolwa ababili badutshulwe balimala kabi, oyedwa waboshwa. Uzobhekana necala lokubamba inkunzi ehlomile nelokuzama ukubulala emaphoyiseni. Alikho iphoyisa elilimale ngesikhathi sokudubulana."
Nonkululeko Nhlapo,https://www.isolezwe.co.za/izindaba/2026-05-15-usebhekene-namanye-amacala-usgt-fannie-nkosi/,"Kwengezwe amanye amacala kuFannie Nkosi Image: Oupa Mokoena / Independent Newspapers USergeant Fannie Nkosi kulindeleke ukuthi avele ngaphambi kwenkantolo yeMantshi yaseThohoyandou ngoLwesihlanu, 15 Meyi 2026. Kusolwa ukuthi ngomhlaka-10 Novemba kunomsolwa owaboshwa ngokutholakala nensangu, izibhamu ezingekho emthethweni kanye neziqhumane. Uphenyo lukhomba ukuthi u-Sgt Nkosi wafika walanda idokodo lecala lokuqala enza sengathi uthunywe indlunkulu yamaphoyisa. Emuva kwezinyanga ezimbalwa kuthiwa waphindela eThohoyandou, wazichaza njengoColonel osuka ehhovisi elikhulu wakhipha insangu eyayishaqwe lapho okugcinwa khona ubufakazi emaphoyiseni. Yize ubufakazi wabubhuka kwelomkhulu, ngokuhamba kwesikhathi kwatholakala ukuthi kunesikhwama esishodayo sensangu. Kwavulwa icala lokuphazamisa ukusebenza kwengalo yomthetho."
