author,url,text
Fanelesibonge Bengu,https://www.isolezwe.co.za/ezemidlalo/ezezimoto/2026-04-20-kwakia-baphaka-impi-kwiranger-nehilux-ngeveni-labo-itasman/,"I-Kia Tasman entsha ishiya abantu abaningi behlukene phakathi ngendlela ebukeka ngayo BASUKELE isidleke sezinyosi kwaKia South Africa ngokwethula iveni labo lokuqala ngqa, iTasman, ababheke ukuzuza lukhulu ngalo. Umphumela kuyoba wukuthi zibatinyele okanye bafinyelele ekhekheni kube wuju lodwa. Izinyosi kulokhu yizingqungqulu ezikhonya emkhakheni wamaveni angama-double cab okuyi-Ford Ranger, Toyota Hilux, Isuzu D-Max, VW Amarok, GWM P-Series, Nissan Navara ne-Foton Tunland. Ngeke ubasole ngokuzama ukufika ojwini kwazise iconsisa amathe le makethe njengoba nyakenye kudayiswe ama-double cab angaphezu kuka-63 000. Uqala nje unyaka u-2026, evile ku-10 000 asefinyelele emakhasimendeni. Uma betinyeleka bazobe belandela ezinyathelweni zeMercedes-Benz ngeveni labo iX-Class eyayisuselwe kwiNissan Navara eyabhacaza baze bayihoxisa. Nokho iTasman ayifani neX-Class ngoba yona ayisuselwe ndawo, kunalokho kwaKia bayakhe kusuka phansi kuya phezulu. Ivele okokuqala emehlweni abantu ngo-2024 kwasuka okukhulu ukukhuluma ngendlela ebukeka ngayo. Namanje lokho kukhuluma akukapheli kusashiya abantu bengundaza ngezizathu ezingefani. Ngingomunye obeshaya amakhala kodwa emuva kokuyizwa ngezami izandla izinsukwana eWestern Cape ngesikhathi yethulwa, ngigcine sengingenankinga ngayo. Nabanye kungenzeka bajike umqondo uma sebeyijwayela. Ukuba le moto ingumuntu mhlawumbe beyizophiwa igama lokuthi uBuhlebuyeza. Ibukeka njengemoto encane okanye iSUV ngaphakathi iKia Tasman Okwamanje ezweni kukhona angu-150 futhi esinye isitokwe samaTasman angu-300 sisendleleni. Lokhu kukhombisa ngokusobala ukuzimisela kwabo ngokunyusa isibalo sezimoto abazidayisayo nonyaka, ngokusho kwesikhulu sakwa-Kia South Africa, uPaul Turnbull. Nyakenye badayise izimoto ezingu-18 843 nokuyisibalo esinyuke sisuka ku-14 103 ngo-2024. Ngo-2026, uTurnbull uthe bafuna ukudayisa ezingu-23 000 kuya phezulu. Ngale kweTasman, kunezinye izimoto ezintsha sha eziyisihlanu ezizayo nonyaka nezimbili ezinamagama asevele ekhona kuleli. Uma sibuyela kwiTasman, ngaphambili igolozile, iyagqama uma ithushuka. Iyagqama njengoba ubude bungu-5.410 mm kuthi ububanzi bube ngu- 1.930 mm. Ama-LED headlights ahlanganiswe nama-daytime running lights bawanameke ezinhlangothini bese ezansi kuba nama-fog lights. Ngikubone kuwabeka engcupheni yokulimala, ikakhulukazi uma usugudla ehlathini elithothene. Uma uyibuka ohlangothini kuvela amarimu angu-17 inch afakwe emasondweni angama-all terrain newindi langemuva elidimile. Kugqama amafenda aqumbile anombala omnyama okuthi uma uthanda uthole afana nombala ofana nomzimba wemoto. Esikhenkeni kunokokusivikela ukuthi singaklwebheki uma ulayishe impahla. Ngikuthandile ukuthi isivalo sesikhenke asisindi uma usivula noma usivala. Kuningi okunye ongakwengeza ngokuthanda kwakho njenge-bull bar, styling bar, i-roller shutter esikhenkeni kanjalo ne-towbar. I-towbar le ungakwazi ukudonsa ngayo isisindo esingu-3 500kg. ITasman ifika ngezinhlobo ezintathu okuyi-LX edonsa ngamasondo amabili, SX ne-X-Pro ezidonsa ngawo wonke. “Wu-last number” iX-Pro ebesihamba ngayo. Ngaphakathi ungafunga ukuthi yi-SUV. Inezihlalo zesikhumba, ezangaphambili okwazi ukuzifudumeza uphinde uzibandise. Okunye okokushisisa yisiteringi. Iphinde ibe ne-touchscreen infotainment system engu-12.3 inch ehlangene ne-digital instrument cluster. Phakathi nendawo kuwona la ma-screen kunesinye esincane esikukhombisa amazinga okushisa nokuthi umoya uphuma kuphi. Besingabonakali kahle ngasohlangothini lomshayeli kudingeka ngitshekise ikhanda ukulunguza. Kwi-infotainment udlala umculo ngezipikha ezikhala kamnandi ze-Harman Kardon, ikukhombisa lonke ingaphandle njengoba inamakhamera zinhlangothi zombili ngaphambili nangemuva, uxhuma iselula nge-Apple CarPlay/Android Auto ngaphandle kwentambo nokunye. Ngiyakuthanda ukuthi kunamabhathini asheshe akufikise kofuna ukukwenza ungathinti kwi-touchscreen ize ingcole. Ngibala inkinobho yokunyusa umsindo, ezokushintsha amazinga okushisa nokunye. Kunezimbobo ezimbili zokushaja nge-USB ngaphambili, eyokushaja ngaphandle kwentambo nezinye ezimbili zokushaja ngemuva. Ngemuva isikhala sabagibeli ngisibone sikahle, kuphela ezinyaweni sincanyana. ITasman ifika nenjini eyodwa engu-2.2 litre kadizili ekhona nakwezinye izimoto zakwa-Kia njengeSorento. Inamandla angu-154kW ne-torque engu-440Nm bese kuthi u-gearbox ube yi-8 speed automatic. Indlela isisuse eWaterfront yaze yayophelela eLambert’s Bay, bude buduze nasezweni elingumakhelwane iNamibia. Sigudle etiyeleni, sangena obhuqwini, saphinde sabuyela etiyeleni. Ngisanda kuyisusa ngiyizwe sengathi inokuthanda ukushintshashintsha amagiya kodwa sagcina sijwayelene. Ngemuva ifika nokokuvikela isikhenke iKia Tasman Amandla abezwakala enele uma isukuma futhi iyicela indlela uma ngifuna ukudlula ezinye izimoto namaloli ahudula izinqola ezilayishe impahla. Inama-drive modes amane okungu-Eco, Normal, Sport no-Tow. Ngaphakathi ithule futhi uma umgwaqo uqala ukuba mubi bekuzwakala kodwa hhayi ngendlela ekhalisayo. Ngeke nokho uyibeke ezingeni leRanger. Ngichazwe yindlela ebambelela ngayo okusizwa kakhulu wukuthi idonsa ngawo wonke amasondo amandlla iwafake lapho edingeka khona. Uma uthanda uyayishintsha idonse ngamabili bese kuthi uma ususobhuqwini uyifake ku-4H okanye u-4Low. Ngike ngayishiya ku-4 Auto obhuqwini ngayibona ilubamba kodwa ngiyizwa ne-traction control ingenelela ukungigcina endleleni. Obhuqwini ibingakhalisi nhlobo ingazweli kakhulu futhi ilinyusa nejubane ngale kokukuthusa ngokuthi ingakuphosa esikhotheni. Akukho lapho sixakeke khona kwadingeka ukuthi sisebenzise i-diff lock kwazise asiziqwalanga izintaba. Angiboni ukuthi ibizoshaya phansi ngoba igabade ilishiye ngo-252mm. Ikwazi nokuzihambela yona uma uyifaka kuX-Trek ongawufanisa ne-cruise control yasobhuqwini. Siphinde sayihloma esihlabathini, okuyindawo ekwazi ukuhamba kuyo ngale kokuxakeka. Esiteringini kunamabhathini okukutshela ukuthi uhamba endaweni enjani njengasesihlabathini, ematsheni nasodakeni Yona ibe isizilungisa ngendlela efanele njengokuthi ithi ukulibamba igiya esihlabathini. KwaKia bathi ngo-100km iphuza amalitha angu-7.8 litres ethangini elingu-80 litres. Ngilunguze ngayibona idla 8.9l/100km. Ngokwami iTasman yiveni elisezingeni nelingase licoshacoshe emakhasimendeni. Izinyanga ezizayo yizona ezizosidweba sicace isithombe sokuthi abashayeli baseNingizimu Afrika bahamba nayo noma bazoqhubeka nokubambelela ezintandokazini zabo iRanger, Hilux okulindeleke entsha maduze neD-Max ethuthukisiwe ezokwethulwa noma yinini. Kia Tasman 2.2D AT 4x2 LX                        R 679,995 Kia Tasman 2.2D AT 4WD SX                      R 879,995 Kia Tasman 2.2D AT 4WD X-PRO               R 999 995 Zifika ne-service plan yeminyaka eyisithupha noma u-90 000km, Roadside assistance weminyaka emihlanu engakalelwe banga ne-warranty yeminyaka emihlanu nayo engakalelwe banga."
Nonkululeko Nhlapo,https://www.isolezwe.co.za/izindaba/2026-05-19-odabuka-emalawi-uvelile-ngolwenkohlakalo-yemali-ye-covid-19-elinganiselwa-kur26m/,"Badedelwe ngebheyili abasolwa ngokukhwabanisa eyeCovid -19 Umsolwa oneminyaka engu-48 ubudala ongowokuzalwa eMalawi, uFumu Mkalira Msiska, unkosikazi wakhe oneminyaka engu-48 ubudala, uGladness Msiska Mkhonto, kanye nomlamu wakhe oneminyaka engu-39 ubudala, uBongani Zoran Mkhonto, bavele ngaphambi kweNkantolo yeMantshi yaseMiddelburg, ngoMsombuluko, 18 Meyi 2026, ngecala lethenda ye-COVID-19 yohlelo lokusiza abasebenzi (TERS). UMsiska nomkakhe bathole ibheyili ka-R300 000 umuntu emunye, kwathi uBongani Mkhonto yena wathola ibheyili ka-R3 000. Laba bobathathu bazinikele ophikweni oluphenya ngamacala enkohlakalo eNelspruit ngeSonto, mhla ziyi-17 Meyi 2026, kulandela uphenyo olude oluqhutshwa oKlebe, iSpecial Investigating Unit (SIU), i-Unemployment Insurance Fund (UIF), kanye nophiko lweNational Prosecuting Authority (i-AFU) lokudliwa kwempahla. Uphenyo luveze ukuthi inkampani, i-A and F Consulting, kusolakala ukuthi yahlomula ngokungekho emthethweni ku-COVID-19 TERS ngokufuna imali yezisebenzi eziyizipoki ezingaphezu kuka-700 kanye nalabo ababeyizisebenzi. Le nkampani kubikwa ukuthi yathola imali elinganiselwa ku-R26 943 793.19 ngalolu hlelo ngo-2020. Kusolwa ukuthi imali yabe isidluliswa isuka kwa-A and F Consulting yayiswa kuKhulani Quality Contribution, okuyinkampani exhumene nonkosikazi kaMsiska. Umlamu kusolakala ukuthi ubegijima ethola imininingwane yomazisi esetshenziswa ukwenza umkhonyovu wokumangalela abantu abayizipoki nababengabasebenzi bale nkampani. Ngesikhathi sophenyo, i-NPA's Asset Forfeiture Unit yathola incwadi yokumisa ukusebenza kwama-akhawunti asebhange futhi yashaqa izimoto ezinhlanu. Ngaphezu kwalokho, kwalondolozwa izakhiwo ezintathu ezisePitoli, eMiddelburg, naseWhite River, kanye nempahla yasendlini kanye nempahla yasehhovisi. Icala lihlehliselwe umhlaka-20 Julayi 2026, ukuze kuqhutshekwe nophenyo. Izindlu ezishaqwe yiNPA zabammangalelwa"
Nonkululeko Nhlapo,https://www.isolezwe.co.za/izindaba/2026-05-18-kusolwa-umndeni-ngokubulala-ngesihluku-isaguga-besisola-ngokuthakatha/,"Isidumbu sikhishwa emfuleni ithimba labatshuzi Kubulawe ngesihluku isalukazi esineminyaka engu-75 engcobo, e-Eastern Cape, sisolwa ngokuthakatha. Ngokwemibiko evelayo, kuthiwa amalungu omndeni wakhe amthathile amyisa emfudlaneni oseduze, amshaya ngepulangwe, amminza. Isidumbu sakhe esinqunu satholwe eduze nomfudlana sinemihuzuko ekhanda nasebusweni kanye nezibazi zokuklinywa entanyeni. Abasolwa babaleke endaweni yesigameko kanti bekungakaboshwa muntu njengoba amaphoyisa ephenya icala lokubulala. I-video ezungeza ezinkundleni zokuxhumana yalesi sigameko esiphazamisayo isiqubule ulaka emphakathini. Umphathiswa inwezokuThuthukiswa koMphakathi uBukiwe Fanta ukugxeke kakhulu ukubulawa kwabantu. Uthi lesi sibhicongo siyingxenye yezinkinga ezikhulayo e-Alfred Nzo Region, lapho sekubulawe abesifazane abane ngoMeyi kuphela.kanti bekungakaboshwa muntu ngesikhathi kubikwa."
Nonkululeko Nhlapo,https://www.isolezwe.co.za/izindaba/2026-05-18-kuvinjwe-ibhasi-lasemalawi-elilayishe-ngokweqile/,"Image: Sandi Kwon Hoo / DFA Amaphoyisa omgwaqo eLimpopo abambe ibhasi okusolakala ukuthi beligcwele ngokweqile ku-N1 eduze komgwaqo obheke eMashishing, ePolokwane. Leli bhasi, elisuka eMalawi liya eGoli, linelayisensi yokulayisha abagibeli abangu-70 kodwa kuthiwa belithwele abantu abangu-90. Iziphathimandla ziphinde zathola ukuthi uhlu lwabagibeli lukhombisa abagibeli abangu-25 kuphela. Izikhulu zakwa-SAPS kanye nezoMnyango wabokufika babizelwe endaweni yesigameko kanti uphenyo lusaqhubeka. UMnyango wezokuThutha nokuPhepha koMphakathi eLimpopo uxwayise ngokuthi ukugcwala ngokweqile kubeka izimpilo zabantu engozini wathi abomthetho bazoqhubeka nokubhekana nokuphulwa kwemithetho yezokuphepha emgwaqeni."
Nonkululeko Nhlapo,https://www.isolezwe.co.za/izindaba/2026-05-18-uyavela-owesilisa-okhulelise-ingane-11/,"Uyavela owesilisa okhulelise ingane 11 Owesilisa okusolwa ukuthi ukhulelise intombazane eneminyaka engu-11 ubudala kulindeleke ukuthi avele eNkantolo yeMantshi yase-Atlantis ngoMsombuluko. Umsolwa, 32, uboshwe ngoLwesihlanu, ngomhlaka-15 Meyi. Okhulumela amaphoyisa eWestern Cape, uCaptain Frederick van Wyk, uthe kunencwadi egunyaza ukuboshwa komsolwa. ""Leli hhovisi lingakuqinisekisa ukuthi owesilisa, 32, uboshwe ngoLwesihlanu, 15 Meyi, ngencwadi egunyaza ukuboshwa. Uzovela eNkantolo yeMantshi yase-Atlantis ngoMsombuluko, 18 Meyi,"" kusho uvan Wyk. Lokhu kuza ngemuva kokuthi izakhamuzi zase-Atlantis zizwakalise ukucasuka ngemuva kokuvela kokuthi intombazane eneminyaka engu-11 ubudala yabeletha esikhathini esingangesonto esidlule, okusolwa ukuthi kungenxa yokuhlukunyezwa ngokocansi okubandakanya umuntu owaziwayo emndenini. Umama wengane uboshiwe wavela eNkantolo yeMantshi yase-Atlantis. INational Prosecuting Authority (NPA) ikuqinisekisile ukuvela kwakhe enkantolo. Okhulumela iNPA, u-Eric Ntabazalila, ukuqinisekisile ukubonakala kwakhe. ""Yebo, singakuqinisekisa ukuthi umama wengane eneminyaka engu-11 ubudala uvele eNkantolo yeMantshi yase-Atlantis ngecala lokwehluleka ukubika ikhomishini yecala locansi,"" kusho uNtabazalila. Icala elibhekene nonina lihlehliselwe uLwesibili, Meyi 19."
Nonkululeko Nhlapo,https://www.isolezwe.co.za/izindaba/2026-05-17-unqotshwe-yizinkabi-ubig-joe-ofe-ehlaselwa/,"UJoseph “Big Joe” Nyalungu, udutshulwe wabulawa abasolwa abangaziwa emagcekeni ebhizinisi lakhe Ngemuva kokusinda esigamekweni sokudutshulwa ngesonto eyedlule, uJoseph “Big Joe” Nyalungu udutshulwe wabulawa NgoMgqibelo emagcekeni ebhizinisi lakhe eMkhuhlu, eMpumalanga. Kubikwa ukuthi abesilisa ababili baphume emotweni eyiveni emhlophe, bangena emagcekeni ebhizinisi likaJoseph “Big Joe” Nyalungu, 62, eMkhuhlu bamdubula bambulala ngoMeyi 16. Ngokwemibiko, uNyalungu phambilini wasinda kwesinye isigameko ngoMeyi 8 waphuthunyiswa esibhedlela iMatikwana. Le nsizwa yaziwa ngokuba yinkosi yabazibgeli bobhejane abangekho emthethweni yayiyiphoyisa ngaphambi kokwenza lomsebenzi eMpumalanga. UNyalungu ubesematheni eminyakeni edlule kulandela ukuboshwa okumataniswa nokubulawa kobhejane. Amaphoyisa aseMpumalanga akuqinisekisile ukuthi aphume umkhankaso wokuthungatha ababulali kulandela isigameko sokudutshulwa kwendoda eneminyaka engu-62 ubudala eMkhuhlu ngoMgqibelo, ngabo-2.30 ntambama. Okhulumela amaphoyisa aseMpumalanga uColonel Mavela Masondo uthe, ngokolwazi lokuqala, abasolwa ababili baphume evenini emhlophe baqonda kumufi ehlezi nabanye abantu emagcekeni ebhizinisi lakhe. ""Isisulu sizame ukubaleka, kodwa abasolwa basilandele futhi kusolakala ukuthi badubule kaningi bebhekise kuso ngaphambi kokuba babaleke endaweni yesigameko ngesivinini esiphezulu ngemoto efanayo."" Uthe umufi uhlonzwe ngabezempilo endaweni yesigameko. “Umufi wadutshulwa walimala endaweni efanayo ngesonto eledlule.” Uqhubeke wathi imbangela yokubulawa kwakhe ibingakaziwa okwamanje. Nokho kuvulwe icala lokubulala kanti uphenyo lusaqhubeka."
Nonkululeko Nhlapo,https://www.isolezwe.co.za/izindaba/2026-05-16-kuphele-ukuphapha-kuboshwa-abebedlala-ngezulu-lezandla/,"Kuphele 'ukuphapha' kuboshwa abebedlala ngezulu lezandla Amaphoyisa aseNingizimu Afrika (SAPS) abophe amadoda amabili ayamaniswa nezibhamu abonakale kwi-video esakazwa ezinkundleni zokuxhumana lapho abesifazane bebonakala bedlala budedengu bephethe izibhamu. Emuva kokusabalala kwe-video, abeSAPS Gauteng Crime Intelligence baqale umkhankaso wokuthungatha abasolwa okuwaholele eTembisa, eGauteng, lapho abasolwa betholakale khona baboshwa. Izibhamu ezibonakale kuvidiyo zithathwe ngamaphoyisa kanti uphenyo lokuqala luveza ukuthi lezi zibhamu azinalayisensi. Ngesikhathi kuqhubeka lo mkhankaso abasolwa baphinde batholakala nemoto ebiduniwe. I-Gauteng Crime Intelligence iyaqhubeka nokuphenya ngabasolwa. Laba balisa ababili abaneminyaka engu-21 no-34 baboshelwe ukwephula umthetho iFirearms Control Act, ukutholakala nezibhamu ezingekho emthethweni nezinhlamvu kanye nokuba nemoto eduniwe. Amantombazane abonakala kule video agcine atholakele ngemuva kokuthi umkhondo wabasolwa ukhombe amaphoyisa lapho ahlala e-Ebony Park, eMidrand. Ngesikhathi amaphoyisa ebuza ngawo kuvele ukuthi abonwe namadoda aseNingizimu Afrika eshayela imoto emhlophe yohlobo lwe-VW Polo. Imoto ibe isivinjwa eduze kwaseKaalfontein, abesifazane ababili abebefunwa batholakale emotweni base beyiswa eTembisa South SAPS. Amaphoyisa aphinde axwayise amalungu omphakathi ngokuphatha budedengu kanye nokukhonjiswa kwezibhamu, ngoba lokho kubeka izimpilo zabantu engozini futhi kuyicala elinzima. Abasolwa kulindeleke bavele eNkantolo yeMantshi yaseTembisa ngesonto elizayo."
Nonkululeko Nhlapo,https://www.isolezwe.co.za/izindaba/2026-05-16-uzovela-ngelizayo-oboshwe-ephuma-kumadlanga/,"Kubikwa ukuthi zimkhalele ephuma kwikhomishini kaMadlanga uBrown Mogotsi. Image: Oupa Mokoena / Independent Newspapers Kubikwa ukuthi zimkhalele ephuma kwikhomishini uBrown Mogotsi ngoLwesihlanu ntambama. Kuthiwa uzovela eNkantolo yeMantshi yaseGoli ngoMsombuluko. UMogotsi uboshwe yithimba lamaphoyisa eSAPS ngesikhathi eshayela esuka ePitoli elibangise eGoli - cishe imizuzu engu-45 ephumile kwikhomishini, nalapho echithe cishe amahora amane ephekwa ngemibuzo. Ngesikhathi ethula ubufakazi, uMogotsi ubelokhu ephindelela ukuthi ubengafuni “ukuzifaka icala” ngesikhathi ecindezelwa ngumholi wobufakazi kanye namakhomishana ngezinto eziningi ezibalulekile. Amaphoyisa akuqinisekisile ukuthi kukhishwe incwadi egunyaza ukuboshwa kwakhe i-J50 ngokuphula umthetho. Ngokusho kwamaphoyisa, leli cala lisukela ecaleni lokuzama ukubulala uMogotsi eVosloorus ngoNovemba nyakenye. Abaphenyi bathi isigameko sokudubula sahlelelwa ngamabomu ukuze kwakhiwe isithombe sokuthi uMogotsi wayekhonjwe indlela."
Nonkululeko Nhlapo,https://www.isolezwe.co.za/izindaba/2026-05-16-kuboshwe-abathulwe-obethole-eyeraf/,"Kuthunjwe osanda kuthola ekaRAF Amaphoyisa KwaZulu-Natal ahlenge owesifazane owayethunjwe kanye nabanye abayisikhombisa ekhaya labo eChappies Section, eMandeville, eSundumbili, ngamadoda angaziwa ezintatha zangoLwesihlanu, 15 Meyi 2026. Izisulu eziyisikhombisa kubikwa ukuthi zidedelwe KwaDabeka ngemuva kwesikhashana, nokho owesifazane, osanda kuthola imali yakhe ye-Road Accident Fund (RAF), uyiswe endaweni engaziwa. Ithimba leProvincial Tracking Team lisebenze ngokuzikhandla lathola imoto eyodwa kwezimbili ezasetshenziswa ngesikhathi kuthunjwa, abopha abasolwa abathathu. Uphenyo luholele amaphoyisa ePhoenix lapho isisulu, esiseminyakeni yo-30 ubudala, sitholakale singenamyocu. Amaphoyisa anxusa abahlomuli be-RAF ukuthi bangazidaluli izinkokhelo zabo noma baziqhayise ngale mali. Abasolwa bazamile ukukhipha imali kaningi kodwa kwanhlanga zimuka nomoya, kodwa bakwazile ukuthenga ngemali elinganiselwa ku-R30 000. Abasolwa ababoshiwe bazovela enkantolo maduze. Kusathungathwa abanye abasolwa."
Nonkululeko Nhlapo,https://www.isolezwe.co.za/izindaba/2026-05-15-okwenzeke-ezinkantolo-namhlanje/,"1008617120__20260430__0 ULehlogonolo Chauke, odume ngelikaShebeshxt ULehlohonolo “Shebeshxt” Chauke (31) uvele okokuqala eNkantolo yesiFunda ePolokwane ngamacala okugebenga nokutholakala nezibhamu ezingekho emthethweni nokuzama ukubulala. Ubhekene namacala angu-20 esewonke, amanye awo inqwaba yokuzama ukubulala. Udaba luhlehliselwe umhla ka-28 Meyi 2026 ukuze kuvunyelwe umbuso ukuthi uqedele ukudalula okuqukethwe emadokodweni abekwe endaweni eyodwa. Umsolwa ugqunywe esitokisini kusukela aboshwa ngonyaka odlule. Uzohlala esitokisini. UFadiel Adams evele enkantolo yeMantshi ePinetown Image: Sibonelo Ngcobo/Independent Media Umholi weqembu lezepolitiki i-NCC nelungu lePhalamende, uFadiel Adams, unikezwe ibheyili ka-R10 000. Icala lihlehliselwe umhlaka-14 Agasti 2026 ukuze kuqhutshekwe nokuqhubeka. Njengengxenye yemibandela yebheyili, ummangalelwa uyalwa ukuba angaxhumani, ngokuqondile noma ngokungaqondile, nanoma ibaphi ofakazi boMbuso kanye/noma ukushushiswa. Ummangalelwa uyalelwa ukuba azibike mathupha eHhovisi Lamaphoyisa aseMitchells Plain Police Station phakathi kwehora le-06h00 no-20h00 njalo ngoLwesibili nangoMgqibelo, kusalindwe ukuphothulwa kwalolu daba. USOMATEKISI uJoe “Ferrari” Sibanyoni nasolwa nabo uMvimbi Daniel Masilela noPhilemon Msiza namhlanje bajoyinwe umsolwa wesine ozinikele emaphoyiseni uBafana Sindane. Namhlanje babuyele enkantolo yeMantshi eKwaggafontein, eMpumalanga icala lahlehliselwa uMsombuluko. Image: Oupa Mokoena / Independent Newspapers Abammangalelwa bepulazi lezidakamizwa eSwartruggens Babuyela esitokisini abammangalelwa anga-11, abatholwe epulazini elikhiqiza izidakamizwa eSwartruggens, eNorth West. Laba nammangalelwe abayisihlanu (5) badabuka eMexico, uFabian Astorga, Jesus Alonso, Medina Astorga, Luis Alberto Ramirez Rios, Jose Andres Medina, Jacquelin Lopez Madrid(owesifazane); abantu ababili (2) baseMozambique, u-Ismael Afiado Massinge, uLourenco Constantino Cumbane; oyedwa (1) ongowaseZimbabwe, uTobias Soyani kanye nezakhamuzi zaseNingizimu Afrika ezintathu (3), uTyron John Schutte, uKyle Schutte, uVusi Amos Mkambi."
Nonkululeko Nhlapo,https://www.isolezwe.co.za/izindaba/2026-05-15-kubi-kwababheke-ukuthola-amajezi-ebhola-ezingojeni/,"Amaphoyisa ashaqe impahla ongumbombayi eGoli I-SAPS e-Gauteng ishaqe izimpahla zomgunyathi ezibiza cishe u-R23m ngesikhathi somkhankaso wezinhlaka eziningi ohlose ukuqeda izimpahla eziwumkokotelo kanye nezingekho emthethweni endaweni edolobheni laseGoli ngoLwesihlanu. Lo mkhankaso ubudidiyelwe uphiko oluphenya izimpahla zomgunyathi lwaseGauteng ngokwesekwa ngamaphoyisa asemngceleni, Public Order Policing (POP), uphiko lwezobugebengu bezohwebo, abavikeli bemikhiqizo kanye nophiko lwezentela lwaseNingizimu Afrika (i-SARS). Impahla eshaqwe amaphoyisa enkabeni yedolobha eGoli Amathimba abomthetho abehamba ehlola amabhizinisi asenkabeni yedolobha ukuthi ayayithobela yini imithetho. Ngesikhathi kuqhubeka lo mkhankaso kuhanjelwe izitolo ezingu-23 zaseshwa nokuholele ekutheni kuthathwe izimpahla nezicathulo zomgunyathi ezingu-27 058. Impahla ezishaqiwr zenani elilinganiselwa ku-R23m. Ama-ejensi okuqinisekisa ukuthotshelwa komthetho azoqhubeka nokuqinisa imisebenzi yokuthobela kanye nokuphoqelela ukuthotshelwa kwemithetho kulo lonke elaseGauteng ukuze kuliwe nezenzo zobugebengu ezihlobene nezimpahla zomgunyathi nezingekho emthethweni. Amateki kanokusho awasalanga"
Nonkululeko Nhlapo,https://www.isolezwe.co.za/izindaba/2026-05-15-kudutshulwe-kwabulawa-abasolwa-ababili-esydenham/,"Kudutshulwe kwabulawa abantu ababili okusolwa ukuthi yizigebengu ebezihlomile ngesikhathi bedubulana namaphoyisa eSydenham ngoLwesine ntambama. Amaphoyisa azibonele isigameko sokugetshengwa kuBurnwood Road lapho abasolwa abathathu, abebeshayela iKia sedan emhlophe, bebegebenga owesilisa impahla yakhe. Abasolwa asukume abona ukuthi kukhona amaphoyisa, bashaya bachitha ngemoto. Ngesikhathi abasolwa bebaleka, omoto yabo ishayisane netekisi base beyishiya. Babaleke ngezinyawo bedubula bebhekise emaphoyiseni, kwadutshulwana. Abasolwa ababili badutshulwe balimala kabi, oyedwa waboshwa. Uzobhekana necala lokubamba inkunzi ehlomile nelokuzama ukubulala emaphoyiseni. Alikho iphoyisa elilimale ngesikhathi sokudubulana."
Nonkululeko Nhlapo,https://www.isolezwe.co.za/izindaba/2026-05-15-usebhekene-namanye-amacala-usgt-fannie-nkosi/,"Kwengezwe amanye amacala kuFannie Nkosi Image: Oupa Mokoena / Independent Newspapers USergeant Fannie Nkosi kulindeleke ukuthi avele ngaphambi kwenkantolo yeMantshi yaseThohoyandou ngoLwesihlanu, 15 Meyi 2026. Kusolwa ukuthi ngomhlaka-10 Novemba kunomsolwa owaboshwa ngokutholakala nensangu, izibhamu ezingekho emthethweni kanye neziqhumane. Uphenyo lukhomba ukuthi u-Sgt Nkosi wafika walanda idokodo lecala lokuqala enza sengathi uthunywe indlunkulu yamaphoyisa. Emuva kwezinyanga ezimbalwa kuthiwa waphindela eThohoyandou, wazichaza njengoColonel osuka ehhovisi elikhulu wakhipha insangu eyayishaqwe lapho okugcinwa khona ubufakazi emaphoyiseni. Yize ubufakazi wabubhuka kwelomkhulu, ngokuhamba kwesikhathi kwatholakala ukuthi kunesikhwama esishodayo sensangu. Kwavulwa icala lokuphazamisa ukusebenza kwengalo yomthetho."
Nonkululeko Nhlapo,https://www.isolezwe.co.za/izindaba/2026-05-15-bayavela-abangu-11-ababanjwe-epulazini-elikhiqiza-izidakamizwa/,"Amaphoyisa athole iziza zokukhiqiza izidakamizwa Abasolwa abayishumi nanye kulindeleke ukuba bavele okokuqala eNkantolo yeMantshi yaseSwartruggens, namhlanje. Laba babhekene namacala ahlobene nokukhiqiza izidakamizwa, ukutholakala nezinsimbi eziyigugu ngokungemthetho, ukutholakala nempahla eyingozi kanye nokwephula uMthetho wokufika kwabantu bokufika. Lokhu kulandela umkhankaso wezobunhloli owenziwe yiNhloko yeCrime Intelligence, ihhovisi lenhloko uezobugebengu obuhleliwe, kanye neDirectorate for Priority Crime Investigation (DPCI) South African Narcotics Enforcement Bureau (SANEB)  kanye nabanye ababambiqhaza okuholele ekuboshweni kwabasolwa abayishumi nanye (11) abaxhumene necala lokukhiqiza izidakamizwa ngoMeyi 13. Lo msebenzi uholele ekutholakaleni kwesikhungo esikhulu sokukhiqiza izidakamizwa esingekho emthethweni okukholakala ukuthi siyabandakanyeka ekukhiqizeni i-methamphetamine."
Nonkululeko Nhlapo,https://www.isolezwe.co.za/izindaba/2026-05-13-uzibiza-ngenceku-kankulunkulu-usibanyoni/,"USOMATEKISI uJoe “Ferrari” Sibanyoni nasolwa nabo uMvimbi Daniel Masilela noPhilemon Msiza besenkantolo yeMantshi eKwaggafontein Image: Oupa Mokoena / Independent Newspapers “MINA ngiyinceku kaNkulukulu”, kusho uJoe “Ferrari” Sibanyoni etshela abezindaba ukuthi umsulwa ngesikhathi evele enkantolo yeMantshi eKwaggafontein, eMpumalanga. USibanyoni uvele nabanye abasolwa okunguMvimbi Daniel Masilela noPhilemon Msiza ngamacala okuqola namabili okushushumbisa imali. Icala elibhekene nosomatekisi uJoe “Ferrari” Sibanyoni livele lashuba ngemuva kokuthi ummeli wakhe uShaun Abrahams SC owayeyisikhulu seNPA, esole uMbuso ngokungazimiseli ngesikhathi ufaka isicelo sokuhlehlisa inqubo yesicelo sebheyili. Abashushisi batshele inkantolo ukuthi uphenyo lusaqhubeka futhi kusadingeka isikhathi sokuqoqa ubufakazi. UMbuso uphinde waveza ukuthi isicelo sebheyili singase singaqhubeki ngoba imantshi obekulindeleke ukuthi ilalele lolu daba ibingakatholakali. U-Abrahams ukuphikisile lokhu wathi uMbuso uhlulekile ukuzilungiselela ngendlela yize uphenyo seludonse isikhathi eside. U-Abrahams uphinde waqondisa abashushisi enkantolo, wathi lolu daba lungaphansi kwesigaba 5 hhayi u-6 we-Criminal Procedure Act. UMbuso uphinde wagxekwa ngokungabanikezi abameli babasolwa uhlu lwamacala Imantshi u-J.T. Erasmus ibuze abashushisi ukuthi ngabe uhlu lwamacala ludluliselwe yini ku-Abrahams. UMbuso uvumile ukuthi awuzange. U-Abrahams utshele inkantolo ukuthi uyayidinga incwadi ukuze aqhubeke nesicelo sebheyili. Inkantolo iluhlehlisele uLwesihlanu lolu daba."
