author,url,text
Sibusiso Mdlalose,https://www.isolezwe.co.za/ezemidlalo/ezinye-ezemidlalo/2026-05-13-ukhawula-unxusa-ukwesekana-kwawasekzn-adlala-kwi-psl/,"Isithombe USIHLALO weDurban City, uFarook Kadodia, ephahlwe nguNdunankulu waKwaZulu-Natal, uThami Ntuli, umengameli weKZN Sports Confederation, uThami Mchunu, umqeqeshi uPitso Dladla, uMphathiswa wezeMidlalo, uMntomuhle Khawula, nabadlali emcimbini wokuhlonipha leli qembu eSouthern Sun Hotel, eThekwini UMPHATHISWA wezeMidlalo, ubuCiko namaSiko KwaZulu-Natal, uMntomuhle Khawula, unxuse ukwesekana emaqenjini esifundazwe adlala kwiPremier Soccer League (PSL) ukuze impumelelo yeDurban City yokuzuza isicoco seNedbank Cup ibe yisikhuthazi nakwamanye akulesi sifundazwe. UKhawula ukusho lokhu ekhuluma nabezindaba emcimbini wokubungaza ukunqoba kweCity iNedbank Cup obuseSouthern Sun Hotel, eThekwini, ngeSonto. Lo mcimbi bewuthanyelwe yizikhulu zeCity, okubalwa kuzo usihlalo, uFarook Kadodia, abadlali nethimba labaqeqeshi, abaxhasi beCity, aboMnyango wezeMidlalo, ubuCiko namaSiko, uNdunankulu wesifundazwe, uThami Ntuli, izikhulu zeSafa KwaZulu-Natal nesifunda iTheku neKwaZulu-Natal Sports Confederation. “Eminyakeni ewu-16 isifundazwe sakithi KwaZulu-Natal sagcina ukunqoba indebe, abafana bamaCitizens bakwenzile lokho, basiqeda isomiso sezindebe. Ngakho sibonga kakhulu kumqeqeshi, uPitso Dladla, usihlalo uKadodia (Farook), ithimba labaqeqeshi, nawo wonke umuntu oyingxenye yaleli qembu ofake isandla empumelelweni yalo. Okuqaphelekayo wukuthi yisizini yokuqala le iDurban City ingenile esigabeni esikhulu seBetway Premiership, kodwa isikwi-Top 8 futhi ayisaphumi, yaphinda yathatha indebe. Siyathokoza futhi ukuthi njengamanje kwi-Top 8 AmaZulu akhona, iGolden Arrows ibukeka izoba khona, neRichards Bay iyasondela,” kusho uKhawula. “Lokhu kusinika ithemba lokuthi kungenzeka sibe namaqembu amaningana kwi-MTN8 ngesizini ezayo. Impumelelo yeDurban City kufanele ibe yisikhuthazi nakwamanye amaqembu akulesi sifundazwe engifisa ukuthi kube nokubambisana kuwona, yize edlala ngokuncintisana. Ukubambisana nokwesekana kwawo kungahamba ibanga ekubuyiseni isithunzi nempumelelo ebholeni laKwaZulu-Natal, eyikhaya lebhola. NeMilford FC noma ingakwazanga ukunqoba iligi (yeMotsepe Foundation Championship), nayo sinethemba lokuthi izophumelela kuma-Play-Offs, yandise isibalo samaqembu akulesi sifundazwe kwiPremiership, futhi sizoyeseka.” ICitizens ibe yiqembu lokuqala laseKZN elinqobe isicoco selokhu kwagcina iLamontville Golden Arrows ngo-2009 inqoba indebe ye-MTN8. Usihlalo weCitizens, uKadodia, uzwakalise ukuthobeka ngomcimbi abawenzelwe wuMnyango wezeMidlalo esifundazweni ukubabonga nokubahlonipha ngokunqoba kwabo iNedbank. “Ibhola laKwaZulu-Natal bekungafanele lilinde isikhathi eside kangaka ukuthola impumelelo. Futhi amaqembu aKwaZulu-Natal akufanele adonse kanzima avike izembe kuwona wonke amasizini. Ibhola kufanele libe yimboni, lithuthukise abantu, lidale amathuba omsebenzi lithuthukise nezokuvakasha. Uma ibhola lisebenza, nomphakathi uyasebenza. Ligcina intsha imatasa, ihlengeke ezidakamizweni nasebugebengwini,” kusho uKadodia. Namuhla ngo-12.30 emini ezitaladini zaseThekwini, kuzoba nombhiyozo weCity nendebe yeNedbank Cup. Kuzosukwa eKing Dinuzulu Park, kubhekwe eMoses Mabhida Stadium."
Sibusiso Mdlalose,https://www.isolezwe.co.za/ezemidlalo/ezinye-ezemidlalo/2026-05-13-idurban-city-nengwadla-kushiya-onozinti-ababili/,"Isithombe UNOZINTI weDurban City, u-Ayanda Mtshali, odalule ukuthi usethi khumu ebholeni elikhokhelayo ekupheleni kwale sizini I-DURBAN City ezodlala kwiCaf Confederation Cup ngesizini ezayo, inenselelo yokuphuma inqina iyozingela unozinti njengoba onozinti bayo ababili, uDarren Keet no-Ayanda “Pepe” Mtshali, bewaphanyeka emgibeni amagilavu ekupheleni kwesizini. Kungakapholi maseko uKeet (36) ememezele ukuthi useyayeka ukudlala ibhola, uMtshali naye usedalule ukuthi yisizini yakhe yokugcina lena. UMtshali (38) odabuka eSection 3, eMadadeni, eNewcastle, uveze ukuthi isinqumo wasithatha ngemuva kokuthi iCity iwine isicoco seligi seMotsepe Foundation Championship ngesizini edlule. Uthe ubehlele ukuthi uzodlala isizini eyodwa kwiBetway Premiership. “Ngibone sekuyisikhathi sokuthi nginike abanye ithuba, ikakhulukazi njengoba bengingasalitholi ithuba lokudlala njalo. Kule minyaka yobudala engikuyona njengamanje ngidinga ukudlala njalo. ""Ngemuva kokuwina kwethu iligi yeMotsepe Foundation Championship ngesizini edlule, bekuvele kusezinhlelweni zami ukuthi ngidlale isizini eyodwa kwiBetway Premiership, bese ngithatha umhlalaphansi ebholeni. ""Okungijabulisayo ukuthi ngiyeke ibhola nendondo yegolide ngokuwina indebe yeNedbank Cup neqembu lami iDurban City,” kusho uMtshali, oqale ukudlala ibhola elikhokhelayo ngesizini ka-2010/11 kwiBlack Leopards. Udlale nakwiFree State Stars, Bloemfontein Celtic, Chippa United, ngaphambi kokujoyina iCity ngesizini ka-2023/24 isabizwa ngeMaritzburg United. Uthe yize esengene endimeni yomculo kodwa ngeke aphume ebholeni njengoba esezinhlelweni zokuzithuthukisa ngolwazi lokuqeqesha. Uneziqu ze-Caf D Licence. “Bengivele nginothando lomculo kusukela ebuncaneni bami. Ngo-2018, ngavula i-studio i-Unified Entertainment eGoli, nomfowethu omncane, u-Anele. ""Sike sama iminyaka embalwa, kwathi ngoJanuwari kulo nyaka, saphinda sasivula i-studio, sasayinisa abaculi abayisithupha ukuqopha kuso. ""Sengiqalile ukuqeqesha onozinti eqenjini lethu leDiski Challenge. Kodwa ngizobona ngokuhamba kwesikhathi ukuthi ngilandela muphi umgudu ekufezekiseni iphupho lami lokuba ngumqeqeshi ngokugcwele,” kusho uMtshali. Njengamanje iCitizens inonozinti ababili, okunguFredrick Asare osayiniswe yileli qembu kule sizini esuka kwi-Asante Kotoko yaseGhana, no-Adren Dreyer naye osayiniswe kule sizini esuka kwiCape Town Spurs."
Sibusiso Mdlalose,https://www.isolezwe.co.za/ezemidlalo/ezinye-ezemidlalo/2026-05-12-idowns-engcupheni-yokuphunyukwa-yisicoco-ishaywa-yigalaxy/,"Isithombe UTEBOHO Mokoena weMamelodi Sundows eshikilisana noMpho Mvelase emdlalweni weBetway Premiership eMbombela Stadium, eNelspruit, izolo ebusuku IMAMELODI Sundowns izifake engcupheni yokuphunyukwa yisicoco seBetway Premiership ishaywa yi-TS Galaxy ngo 3-2 koweligi eMbombela Stadium, eNelspruit, ngoLwesibili ebusuku Amagoli eGalaxy ashaywe nguVictor Letsoalo okube yiphenathi, Sedwyn George ngesiwombe sokuqala, noMpho Mvelase ngesibili. AweSundonwns ashaywa uBrayan Leon womabili angene ngesiwombe sokuqala okubalwa nephenathi ayishaye sekusele imizuzu embalwa kuyiwe ekhefini. Lokhu sekusho ukuthi eZimnyama ezisendaweni yesibili ngamaphuzu awu-65, sezidinga ukushaya iDurban City ngoMgqibelo e-Orlando Amstel Arena, eSoweto, ziqukule isicoco seligi. Uma zihluleke lapho zinelinye ithuba njengoba zizobhekana ne-Orbit College ngoMeyi 23. . Yize iSundowns yenze izinguquko emuva kulo mdlalo iqalisa uKegan Johannes endaweni kaKhulumani Ndamane owenze amaphutha emdlalweni wangoMgqibelo iwina ngo 7-4 kwiSiwelele kodwa buphinde bagqama ukuthaka odongeni lwayo. Zibuya nje ekhefini iGalaxy ithole igoli lesithathu uMvelase ethola ibhola engamakwe muntu ngomzuzu ka-46. Ngemuva kokungenelwa yileli goli lesithathu kweSundowns, yenze izinguquko ezisheshaya iphinde ibuyisa uNdamane odongeni lwasemuva engena endaweni kaGrant Kekana, yafaka noTashreeq Mathews noMiguele Reisinho ezindaweni zo-Arthur Sales noMarcelo Allende. Nokho lokhu akuwenzanga umehluko kwazise iGalaxy iphumelele ukumaka kwaze kwaphela umdlalo. AmaSandawana azodlala ne-Esperance kowomlenze wokuqala wamanqamu weCaf Champions League ngeSonto ngo-4 ntambama."
Sibusiso Mdlalose,https://www.isolezwe.co.za/ezemidlalo/ezinye-ezemidlalo/2026-05-13-owomkhambathi-uvuma-ingcindezi-kowamanqamu-wemotsepe/,"Isithombe UMQEQESHI woMkhambathi FC, uXolani Khumalo, ezakhe ezizotholana phezulu noMvoti FC kowamanqamu wesifundazwe weSafa KwaZulu-Natal, ABC Motsepe League eSugar Ray Xulu Stadium, eClermont, ngoMgqibelo UMQEQESHI woMkhambathi FC, uXolani “Sdoks” Khumalo, uyavuma ukuthi banengcindezi yokuwunqoba umdlalo wabo wamanqamu wesifundazwe weSafa KwaZulu-Natal ABC Motsepe League wokuhlunga iqembu elizomela isifundazwe kumaPlay-Offs kazwelonke okuzabalazela ukukhushulelwa esigabeni seMotsepe Foundation Championship. UMkhambathi uzotholana phezulu noMvoti FC kowamanqamu wokukhipha inkunzi yaKwaZulu-Natal kwi-ABC Motsepe League ngoMgqibelo ngo-1 ntambama, eSugar Ray Xulu Stadium, eClermont. UMvoti uqede uqhwakele ngamaphuzu awu-59 ku-Stream A, uMkhambathi waqeda phezulu ngawu-55 ku-Stream B. Iqembu elizophumelela kulo mdlalo wangoMgqibelo, lizomela iKZN emidlalweni kazwelonke lapho kuzohlungwa khona amaqembu amabili azokhushulelwa kwiChampionship. AmaPlay-Offs kazwelonke e-ABC Motsepe League azobanjelwa eMthatha, e-Eastern Cape, ngoJuni 1-7. “Njengeqembu sinayo ingcindezi ngalo mdlalo esizowudlala noMvoti ngoba nangesizini edlule sahambe safika kowamanqamu lapho sahlulwa khona yiMidlands (Wanderers). ""Nabaphathi (boMkhambathi) bafisa ukuthi iqembu likhushulelwe esigabeni seMotsepe Championship kule sizini, nangendlela abaleseka ngayo iqembu kusukela isizini iqala kuze kube manje. ""Banezifiso ezinkulu ngaleli qembu ngoba bafuna ukulibona lidlala esigabeni esikhulu, limele indawo yaseMkhambathini,” kusho uKhumalo. “UMkhambathi uyiqembu elikhula ngesivinini elifiswa ngabaqeqeshi abaningi ukuliqeqesha. Nokho sikulungiselele ukubhekana noMvoti, siyakwazi esikulundele kubona, nabo bayakwazi abakulindele kithina. Ngakho silindele umdlalo onzima kodwa ozokwenza abathandi bebhola babheme bakholwe."" UKhumalo odabuka KwaNomoya, eSahlumbe, ojoyine uMkhambathi kule sizini esuka kwiFC Drakensberg, usizana noNkosingiphile “Dimco” Ntinga oyiphini lakhe. UMkhambathi ufinyelele emzuliswaneni we-Last 16 weNedbank Cup, waguqiswa yiMilford FC ngo 3-0. “Nakho ukufinyelela kwethu kwi-Last 16 yeNedbank Cup kube yisikhuthazi esikhulu kubadlali bethu, kwenyusa nezinga labo lokuzethemba nasemidlalweni emqoka yeligi esiyidlalile,"" usho kanje uKhumalo. Uma kwenzeka uMkhambathi ugcina ngokuphumelela ukuya kumaPlay-Offs kazwelonke uzoba nenye ingcindezi yokulandela ezinyathelweni zabakhaya bawo, iMidlands Wanderers, abaphumelele ukwenyukela kwiChampionship ngesizini edlule."
Sibusiso Mdlalose,https://www.isolezwe.co.za/ezemidlalo/ezinye-ezemidlalo/2026-05-13-icity-nemilford-ethubeni-lamaplay-offs-izembe-kwileopards-nebaroka/,"Isithombe I-CAPE Town City ezibeke ethubeni elihle lokuzibekisela indawo kuma-PSL Promotion Play-Offs ngokushaya iBaroka FC ngo 1-0 emdlalweni weMotsepe Foundation Championship e-Athlone Stadium, eKapa, izolo ntambama I-CAPE Town City izibeke ethubeni elihle lokuzibekisela indawo kuma-PSL Promotion Play-Offs ngokushaya iBaroka FC emdlalweni weMotsepe Foundation Championship obudlalelwa e-Athlone Stadium eKapa, izolo ntambama. Igoli likaGabriel Amato elingene ngesiwombe sokuqala ngomzuzu ka-22 yilona eliqinisekise amaphuzu amathathu amqoka kuleli qembu laseKapa elisemshikashikeni wokuzabalazela ukubuyela esigabeni seBetway Premiership. Njengoba iKruger United isilinde isilinde umdlalo wayo wokugcina wokusonga isizini ngeSonto elizayo, ukugcotshwa ngokusemthethweni njengompetha beMotsepe Championship, umbango usuphakathi kweCity, Milford FC, Hungry Lions neCasric Stars, ukulwela indawo kumaPlay-Offs. Womathathu la maqembu asembangweni wokuzibekisela indawo kumaPlay-Offs abuye namaphuzu aphelele, njengoba iMilford ishaye i-University of Pretoria ngo 2-0 eMhlathuze Sports Complex, eRichard Bay, ngenkathi iHungry Lions inenebula iHighbury FC ngo 4-0 eNelson Mandela Bay Stadium, eGqeberh. Kwathi iCasric yabhaxabula i-Upington City ngo 2-0 eMxolisi Dicky Jacobs Stadium, e-Upington. Amaqembu amabili azoqeda endaweni yesibili neyesithathu azodlala neliqede endaweni ka-15 kwi-lo yePremiership. IMilford isendaweni yesibili ngamaphuzu awu-53, ilandelwa yiCity endaweni yesithathu neyesine ngamaphuzu awu-51 ngokulinganayo ngokwehlukana, kube yiCasric kweyesihlanu ngawu-49 Lokhu kusho ukuthi imidlalo yangeSonto elizayo, ngekawafawafa kula maqembu alwela ukuya kumaPlay-Offs. I-The Citizens eqeqeshwa uJan Vreman negqishe ngeningi labadlali abanamava okudlala kwiPremiership, izosonga isizini ngomdlalo wasekuhambeni neLeicesterford City ngeSonto, eDobsonville Stadium, eSoweto. IMilford eqeqeshwa uXanti Pupuma isonga isizini ngomdlalo wasekuhambeni neHungry Lions, eMxolisi Dicky Jacobs, e-Upington, iCasric isonge neGomora United eSolomon Mahlangu Stadium, KwaMhlanga. Kanti iKruger eshaye iGomora ngo 1-0 izolo, izosonga ngomdlalo wasekhaya ne-The Bees FC KaNyamazane Stadium, nokuyilapho ezobe isinikwa khona indebe yayo yeMotsepe Championship. Kanti ngakolunye uhlangothi, isifundazwe iLimpopo sikhungethwe yifu elimnyama njengoba womabili amaqembu amabili akulesi sifundazwe egawulwe yizembe, okuyiBaroka FC neBlack Leopards. Phezu kokunqoba kweLeopards ngo 2-1 ishaya iVenda FC izolo, eThohoyandou Stadium kodwa lokho akuyisizanga ngenxa yesibalo samaphuzu. Imiphumela yeMotsepe Foundation Championship: The Bees 1-1 Leicesterford City; Black Leopards 2-1 Venda FC; Cape Town City 1-0 Baroka; Upington City 0-2 Casric Stars; Highbury 0-4 Hungry Lions; Milford FC 2-0 Univ. of Pretoria; Gomora 0-1 Kruger United; Midlands Wanderers 1-1 Lerumo Lions"
Sibusiso Mdlalose,https://www.isolezwe.co.za/ezemidlalo/ezinye-ezemidlalo/2026-05-13-uzakithi-wephule-irekhodi-emjahweni-wase-italy/,"Isithombe INSEPHE yaseNingizimu Afrika ka-400m, uZakithi Nene, owenze ezibukwayo eqopha irekhodi elisha lika-400m emjahweni wase-Italy, iPegaso Meeting, ngempelasonto INSEPHE ka-400m yaseNingizimu Afrika, uZakithi Nene, yenze ezibukwayo iqopha irekhodi elisha lika-400m kwabesilisa emjahweni i-Pegaso Meeting, eStadio Luigi Ridolfi, eFlorence, e-Italy, ngempelasonto. Uqophe isikhathi esiwu-44.44 seconds, eshiya uLapo Bianciardi wase-Italy, olale isibili ngesikhathi esiwu-46.01. UNene (28) odabuka eMnambithi, ukhipha unyawo kulo mjaho wase-Italy nje, akukapholi maseko ebambe iqhaza empumelelweni yeqembu laseNingizimu Afrika lika-4x400 le-relay elibuye nendondo yesiliva kowe-World Athletics Relays, eGaborone, eBotswana, ngoMeyi 3. “I-Italy inendawo ekhethekile enhliziyweni yami. Ngaqala khona lapha e-Italy ukugijima kwiDiamond League ngo-2021, eFlorence. Ngiyayijabulela imijaho yase-Italy ngenxa yomoya nokwesekwa okuqhamuka ezibukelini zakhona. Ngizizwa ngisefomini eyisimanga kusukela ngaqala ukugijima. Ngifuna ukuqhubeka ngigijime ngenze isikhathi esingaphakathi kuka-45 seconds ukuze ngikwazi ukuqhudelana nabagijimi abasezingeni eliphezulu emhlabeni,” kusho uNene, ecashunwa yi-WorldAthletics.com UNene ovutha engabaselwe kusukela kuqala u-2026, ngo-Ephreli udle umhlanganiso ku-400m emjahweni iKip Keino Classic, eNairobi, eKenya, ngesikhathi esiwu-44.50. Kanti nyakenye uqophe isikhathi sakhe (PB) esiwu-43.76 ethatha indawo yesihlanu kowe-World Athletics Ultimate Championships, eTokyo, eJapan. Ungomunye wezibabuli zabagijimi iNingizimu Afrika ezothembela kubona ekwenzeni kahle komunye umqhudelwano we-World Athletics Ultimate Championships, ozobanjelwa eBudapest, eHungary, ngoSepthemba. Khonamanjalo: Umjaho i-Absa Run Your City 10km uhlehlisiwe ngenxa yesimo sezulu esingesihle esifundazweni iWestern Cape. Lo mjaho womlenze wesibili webanga lika-10km obekulindeleke ubanjelwe eKapa, izolo ekuseni, ngoLwesihlanu kuthathwe isinqumo sokuthi uhlehliswe ngenxa yokuthi izangoma zezulu, bese ziqinisekise ukuthi idolobha iKapa nezindawo eziningi ezingaphansi kwesifundazwe iWestern Cape, zizohlaselwa ngumoya onamandla ngeSonto (izolo) ozolandelwa ngumsinga obandayo ngeSonto (namuhla). Umlenze wokuqala we-Absa Run ubanjelwe eGqeberha ngoMashi, wanqotshwa u-Adriaan Wildschutt, kwabesifazane kwaphuma phambili uBrenda Jepchirchir waseKenya."
Sibusiso Mdlalose,https://www.isolezwe.co.za/ezemidlalo/ezinye-ezemidlalo/2026-05-10-ukadodia-ucacisa-ngekusasa-lomqeqeshi-wedurban-city/,"Isithombe UMQEQESHI weDurban City osabambile, uPitso Dladla, okulindeleke kucace maduze ngekusasa lakhe ekuholeni leli qembu ngesizini ezayo ngemuva kokulinqobela indebe yeNedbank Cup USIHLALO weDurban City, uFarouk Kadodia, uveza ukuthi kuzocaca maduze ngekusasa lomqeqeshi waleli qembu osabambile, uPitso Dladla. UKadodia olumane indlebe neSolezwe, ukubeke kwacaca ukuthi sebelinde ukusongwa kwale sizini esezihubela sakusha kuyona ngaphambi kokuthatha isinqumo ngethimba labaqeqeshi elizohola leli qembu ngesizini ezayo. UDladla uthathe izintambo zokuqeqesha njengebamba ngoFebhuwari, ngemuva kokukhonjwa indlela kukaSinethemba Badela. Ngaphansi kwesandla sikaDladla odabuka eNewtown, oThongathi, eThekwini, iCity iqophe umlando ngeledlule ngokuba yiqembu lokuqala laKwaZulu-Natal eliphakamise indebe yeNedbank Cup ngokuguqisa i-TS Galaxy ngo 2-1 kowamanqamu ePeter Mokaba Stadium, ePolokwane. Ngaphezu kwalokho, isenethuba lokuqeda kwi-Top 8 ngesizini yalo yokuqala kwiBetway Premiership njengoba isendaweni yesikhombisa kwi-log. Inselelo ebhekene noKadodia wukuthi uDladla akazo iziqu zokuqeqesha ezifanele njengoba ngesizini ezayo bezodlala kwiCaf Confederation Cup. Ngokomthetho weCaf, uDladla ngeke avumeleke ukuhlala ebhentshini njengoba eneziqu zokuqeqesha uCaf B License esikhundleni sezeCaf A noma ezePro License. Lokhu kusho ukuthi iCity izophoqeleka ukuqasha umqeqeshi oneziqu ezifanele, uDladla abuyele esikhundleni sokuba yiphini. “Sizolibuyekeza ithimba labaqeqeshi ngezinhloso ezinhle ngekusasa leqembu. Leli yithimba lesikhashana njengoba singakamqoki ngokugcwele umqeqeshi oyinhloko. ""Sesisalelwe yimidlalo emibili ukusonga isizini, ngakho isinqumo ngethimba labaqeqeshi sizosithatha uma kuphela isizini. ""Siyazazi izinhlelo esinazo ngesizini ezayo ngakho silinde kuphele isizini kucace ukuthi siyangena kwi-MTN8 noma cha,” kusho uKadodia."
Sibusiso Mdlalose,https://www.isolezwe.co.za/ezemidlalo/ezinye-ezemidlalo/2026-05-06-idowns-ne-as-far-bashaya-amakhala-ngonompempe-wezimanga-kwi-afcon/,"Isithombe UNOMPEMPE wase-DRC, uJean-Jacques Ndala, okushaywa amakhala ngokuqokwa kwakhe ukudlalisa owamanqamu eCaf Champions League phakathi kweMamelodi Sundowns ne-AS FAR ngoMeyi 17, eLoftus Versfeld Stadium, ePitoli INHLANGANO eyengamele ibhola e-Afrika, iConfederation of African Football (Caf) iphonselwe inselelo ngesinqumo sayo sokuqoka unompempe waseDemocratic Republic of Congo (DRC), uJean-Jacques Ndala,  njengezodlalisa umdlalo womlenze wokuqala wamanqamu weCaf Champions League phakathi kweMamelodi Sundowns ne-AS FAR Rabat yaseMorocco ngoMeyi 17. Owomlenze wokuqala uzodlalelwa eLoftus Versfeld Stadium, ePitoli, ngoMeyi 17, kuthi owomlenze wesibili ugijinywe ngoMeyi 24 ePrince Moualy Abedellah Stadium, eRabat, eMorocco. Kuvela ukuthi iSundowns ne-AS FAR bathumele izikhalo ezisemthethweni kwi-Caf ngoMsombuluko beshaya amakhala ngokuqokwa kukaNdala. La maqembu akhala ngokuthi ukuqokwa kwalo nompempe kubukela phansi ubumqoka balo mdlalo wamanqamu weChampions League ngenxa yomlando wakhe ongemuhle. UNdala nguyena owayeshaya impempe emdlalweni wamanqamu we-Africa Cup of Nations (Afcon) phakathi kweMorocco neSenegal ngoJanuwari, eMorocco. Sekungumlando ukuthi kulo mdlalo wamanqamu we-Afcon kwaba nezidubedube ngenxa yezinqumo zakhe ezishaqisayo. Kusolwa yena ngokuvumela iSenegal ibuyele enkundleni ngemuva kokuphuma enkundleni kulandela ukubeka kwakhe iphenathi. Kumanje kusalindwe isinqumo se-Court of Arbitration for Sport (CAS) ngemuva kokuba iSenegal idlulise isikhalo ikhala ngesinqumo seCaf sokunika iMorocco indebe ye-Afcon ekubeni kuyiyona iSenegal eyanqoba ngo 1-0 kowamanqamu. Ngokusho kwe-Morocco World News, imithombo engaphakathi kwi-Caf iqinisekisile komunye umthombo wezindaba waseMorocco, i-El Botola, ukuthi la maqembu azodlala owamanqamu weChampions League anemibuzo ngokuqokwa kukaNdala. Ikomiti le-Caf eliqoka onompempe likuqinisekisile ngeSonto ukuthi uNdala nguyena ozodlalisa owamanqamu weChampions League, azolekelelwe ngabakhaya bakhe uJulien Ngila noGradiel Munia njengabasizi bakanompempe. UJesse Moise uzoba yi-fourth official. U-Ahme Abdelaziz waseSudan uzoqhoqhobala i-Video Assistant Referee (VAR), esizwa ngu-Ahmed Shelmani waseLibya noDiana Chikotscha waseZambia."
Sibusiso Mdlalose,https://www.isolezwe.co.za/ezemidlalo/ezinye-ezemidlalo/2026-05-05-ikruger-izibophezela-ukuqoqa-amaphuzu-nakuba-isingompetha/,"Isithombe UMDLALI wasesiswini kwiKruger Untied, uCelimpilo Ngema, obambe iqhaza elikhulu empulelweni yaleli qembu eselingompethea beMotsepe Foundation Championship UMDLALI wasesiswini kwiKruger United, uCelimpilo “Zidane” Ngema, utusa ukuzikhandla nokusebenza ngokubambisana njengekhubalo lokunqoba isicoco seMotsepe Foundation Championship kwaleli qembu elizogijima kwiBetway Premiership ngesizini ezayo. Yize kusasele imidlalo emibili kusongwe isizini ka-2025/26 yeChampionship, iKruger isivele iyiwinile iligi yalesi sigaba. Iqede ukuqagela ngombango weligi ibhaxabula iBlack Leopards ngo 3-1 ngoMgqibelo KaNyamazane Stadium, KaNyamazane. UNgema (28) waseThubalethu, eMelmoth, ngomunye wabadlali ababambe iqhaza elikhulu empumelelweni yeKruger ayijoyine esuka kuMaZulu ekuqaleni kwesizini. “Ukuzikhandla kwethu nokusebenza ngokubambisana njengabadlali beqembu kugcine kuthela izithelo. Ngakho sonke sithokozile ngokuthi sigcine sikwazile ukufeza umgomo wethu ebesizibekele wona kule sizini obekuyikho ukulwela ukuwina iligi,” kusho uNgema. Lo mdlali oyinjini yasesiswini, ohlukane naMaZulu esedlale amasizini amabili kuwona ubalwa nabadlali abadlale kwiPremiership okubalwa kubona uTercious Malepe, Morne Nel, Wandisile Letlabika, Sipho Sibiya noNtsako Makhubela. “Ukukhushulelwa kwiBetway Premiership kweqembu kusho lukhulu kimina ngoba kunginika elinye ithuba engilithatha njengethuba lesibili lokuthi ngibuyele ekudlaleni esigabeni seBetway okuyisigaba esifiswa yiwo wonke umdlali odlala ibhola elikhokhelayo. Ngizimisele ukulibamba ngazo zombili leli thuba, ngiqhubeke nokuzimisela,""kusho uNgema. IKruger ivule igebe lamaphuzu ayisishiyagalombili phakathi kwayo neMilford FC esendaweni yesibili ngawu-50. Izodlala neGomora United eMalamulele Stadium, eMalamulele, ngeSonto ngo-3 ntambama. Emdlalweni wokugcina izodlala ne-The Bees ekhaya. “Nakuba sesazi ukuthi singompetha beligi kodwa sisazoqhubeka sidlale ngokuzimisela nakule midlalo emibili esisalele, siziqophele owethu umlando ngokuqeda isizini ngamaphuzu amaningi.” usho kanje uNgema. Ngesizini edlule iDurban City inqobe iligi yeMotsepe Championship ngamaphuzu awu-58, kanti iKruger isethubeni lokwedlula irekhodi lamaphuzu awu-62 leThanda Royal Zulu eyanqoba ngawo isicoco seChampionship ngesizini ka-2016/17."
Sibusiso Mdlalose,https://www.isolezwe.co.za/ezemidlalo/ezinye-ezemidlalo/2026-05-05-sisengakwazi-ukuqeda-endaweni-yesithathu-matlhoko/,"Isithombe UMGADLI waMaZulu FC, uThapelo Matlhoko, ongangabazi ukuthi basenethuba lokuqeda isizini besendaweni yesithathu kwi-log yeBetway Premiership bazibekisele indawo kwiCaf Confederation Cup UMGADLI waMaZulu FC, uThapelo Matlhoko, akangabazi ukuthi basenethuba lokuzibekisela indawo kwiCaf Confederation Cup ngokuqeda endaweni yesithathu kwi-log yeBetway Premiership ngokuphela kwale sizini ka-2025/26 esisongwa. AmaZulu, asendaweni yesine kwi-log yePremiership, abalwa namaqembu asalwela ukuqeda endaweni yesithathu okuyindawo eyisango lokuyodlala kwiCaf Confed. Iqembu elizoqeda endaweni yesithathu kwi-log kule sizini lizojoyina iDurban City kwiCaf Confed esivele izibekisele indawo kulo mqhudelwano wasezwenikazi lase-Afrika ngokunqoba isicoco seNedbank Cup ngempelasonto. IKaizer Chiefs isahlezi endaweni yesithathu ngamaphuzu awu-47, ilandelwa aMaZulu ngawu-42, kube yiSekhukhune United kweyesihlanu ngawu-39. AmaZulu azodlala neLamontville Golden Arrows kowePremiership wabakhaya baseThekwini kusasa ngo-7.30 ebusuku, eMoses Mabhida Stadium, eThekwini. Lo mdlalo ufana nowamagqubu kwazise emidlalweni emithathu AmaZulu yiwona anqobile ngesikhathi la maqembu etholene phezulu kowabakhaya. Kule midlalo kubalwa nowomzuliswano wokuqala wesizini AmaZulu aguqisa kuwo i-Arrows ngo 1-0 ngoDisemba 2 eKing Zwelithini Stadium, eMlaza. “Ngumdlalo omkhulu wabakhaya, esizimisele ngokuwunqoba noma sazi ukuthi akuzukuba lula ukubhekana ne-Arrows,” kusho uMatlhoko. Usuthu luza kulo mdlalo luthelwe ngezibonkolo njengoba emdlalweni eligcine ukuwudlala wePremiership luvulele isibhaxu sika 5-1 kwiChippa United. “Ngikholwa wukuthi sisengakwazi ukuqeda endaweni yesithathu. Sidlala kahle futhi sizimisele. Ngisho nayo iKaizer Chiefs izoshaqeka ngoba izosithola simi ngomumo siyilindile,” kusho uMatlhoko ngokuzethemba. UMatlhoko (23) odabuka eMunsieville, eKrugersdorp, ujoyine Usuthu ngaphambi kokuqala kwale sizini esuka kwiKruger United edlala kwiMotsepe Foundation Championship, lapho abenza khona ezibukwayo waphenduka inyama emaqenjini ehlukene ePremiership. Nakuba efike wabhekana nobunzima ekutholeni ijezi ngaphansi komqeqeshi u-Arthur Zwane, kodwa usalibambe ngazo zombili ithuba asalinikiwe. Emidlalweni eyisishiyagalombili asayidlalile useshaye amagoli amathathu, waba nesandla kwelilodwa. “Zonke izinto zenzeka ngesizathu. Yebo bekungelula ukuhlala ngingadlali kodwa bengazi ukuthi ithuba lami liyeza. Okwenzeka kimi kule sizini ngikuthatha njengesifundo, ikakhulukazi njengoba kuyisizini yami yokuqala ngidlala kwiPremiership. Ngikholwa wukuthi ngesizini ezayo ngizokwenza okungcono kakhulu ukusiza iqembu lami,"" usho kanje uMatlhoko. Ngemuva kowe-Arrows, Usuthu luzokwamukela iChiefs eMoses Mabhida Stadium ngoMeyi 16 ."
