author,url,text
Mhlengi Shangase,https://www.isolezwe.co.za/izindaba/2026-05-19-i-eff-igxeka-abazama-ukukhipha-umalema-kwelasephalamende/,"I-EFF isikhwele yadilika ehlanganweni iHelen Suzman Foundation, eye enkantolo ifuna kuphoqwe iPhalamende ukuthi licubungule ukuthi ngabe usakulungele yini umholi waleli qembu uMnuz Julius Malema, ukuba yilungu lekomiti lasePhalamende iJudicial Service Commission (JSC). Le nhlangano ikhala ngokuthi uMalema uhlale egxibha izimantshi namajaji kanti futhi usanda kulahlwa yicala. Okhulumela i-EFF uMnuz Sinawo Thambo, usole ipolitiki ngesinyathelo sale nhlangano sokuya enkantolo yaseWestern Cape, ifuna iPhalamende liyibheke kabanzi ekaMalema kuleli komiti eliphonsa imibuzo izimantshi namajaji azoqokelwa ezinkantolo ezehlukene. Uthe ngalokhu izama ukuvala umlomo abagxeka ezobulungiswa kuleli. ""Le nhlangano ifuna kususwe abantu abagxeka ukusebenza kwezobulungiswa kuleli okuyinto efana nengcindezelo. Amajaji nezobulungiswa kumele bagxekwe uma kukhona ukungahanjiswa kahle kwezinto,"" usho kanje. Uthe sikhona isikhathi lapho amajaji kanjalo nezobulungiswa ezihluleka khona ukushushisa osopolitiki. Ubale udaba lwemali eyatholwa epulazini likamengameli Cyril Ramaphosa, iPhala Phala. ""Le nhlangano ayikaze ithi vu ngendaba yePhala Phala. Kuyacaca ukuthi kukhethwa iphela emasini uma kuyiwa ezinkantolo,"" kusho uThambo. Ummeli wale nhlangano, u-Advocate Jason Whyte, ekhuluma neSABC, uthe ziningi izikhawu lapho uMalema elahlwa khona amacala ezinkantolo futhi babona engakulungele ukuba yingxenye yaleli komiti ePhalamende. ""Usanda kulahlwa yicala lokuqhumisa isibhamu noma enikwe ithuba lokuthi adlulise isigwebo. Uhlale egxibha ezobulungiswa egxeka amajaji kanjalo nezimantshi ezibiza ngabantu abanobandlululo ekubeni esekomitini elibaluleke kangaka ezweni. IPhalamende yilona elijuba amalungu amaqembu ahlukene kwiJSC, ngakho kumele kube abantu abaqotho abajutshwayo,"" usho kanje. Uthe ngalesi sinyathelo abazami ukunqumela iPhalamende ukuthi lijube bani kwiJSC. ""Sifuna wonke amalungu akwiJSC ahlale ebhekwa indlela aziphethe ngayo. Sifuna iPhalamende libheke ukuthi usakulungele yini ukuba yingxenye yekomiti,"" usho kanje. Uthe bazohlahla indlela eya phambili uma sekuphume isinqumo senkantolo. ""Siyosihlonipha isinqumo senkantolo esiyophuma. Siyobe sesibheka ukuthi yiliphi igxathu elilandelayo esizolithatha."" UMalema wakhwela wadilika emantshini uTwanet Olivier, eyamgixabeza ngeminyaka emihlanu ngokuqhumisa isibhamu engqungqutheleni ye-EFF ngo-2018. Wasola le mantshi ngokuba nobandlululo wayisola ngokuba yilungu le-AfriForum."
Mhlengi Shangase,https://www.isolezwe.co.za/izindaba/2026-05-19-i-iec-ikhathazekile-ngamampunge-osopolitiki-ngokhetho/,"Image: Armand Hough / Independent Newspapers IKHATHAZEKILE iKhomishini yezoKhetho, ngosopolitiki abatshala ungabazane emphakathini bafafaze amanga ngemiphumela yokhetho kuleli. IKhomishini ithe abenza lokhu bafaka abantu ingebhe ngokhetho oluzayo ngoNovemba 4, 2026. Okhulumela iKhomishini, uNkk Kate Bapela, uchithe izinsolo zomholi we-EFF uMnuz Julius Malema, zokuthi iKhomishini yaphuca leli qembu amavoti okhethweni lwango-2024, yawapha i-ANC. Ubephendula izinsolo zikaMalema azenze ekhuluma kwenye yama-podcast, lapho ethe amavoti asesikhungweni avota kusona okuyisikole iMponegele Primary ePolokwane, ashintshwa anikwa i-ANC. ""Siyakuchitha okushiwo uMalema njengoba imiphumela eyayiphanyekwe kulesi sikhungo, ihambisana ncamashi naleyo esesikhungweni semiphumela. Lezi zinsolo zizokwehlisa ithemba emphakathini ngokhetho. Ziletha nongabazane kubantu ngemiphumela yokhetho. Azilona iqiniso lezi zinsolo,"" usho kanje. UNkk Bapela uthe imiphumela yokhetho ibalwa esikhungweni kukhona abamele amaqembu. ""Kusuke kukhona nezingqapheli kanjalo nabamele amaqembu uma kubalwa imiphumela esikhungweni. Le miphumela isayinwa nabasuke bemele amaqembu."" Uthe izikhulu zeKhomishini zizohlangana nabaholi be-EFF ngoLwesine. ""Yilapho laba baholi silindele ukuthi baveze izikhalazo zabo. Lo mhlangano ucelwe yi-EFF kanti siqhubeka lapho sigcine khona njengoba sihlangana nezinhlaka ezehlukene ngezithinta amalungiselelo okhetho,"" kuqhuba uNkk Bapela. Uthe bahlale beyivulile iminyango emaqenjini ezepolitiki njengoba kunanekomiti elinawo wonke amaqembu lapho kubhungwa khona ngezinto ezishisa ibunzi ngezokhetho. Uveze ukuthi abafuni abantu ukuthi balahlekelwe ukwethemba iKhomishini. Akuyena kuphela uMalema okhala ngokubanjwa inkunzi okhethweni, kodwa neqembu iMKP likhala esifanayo. Umholi weMKP, uMnuz Jacob Zuma, usanda kuphakamisa ukuthi luhlehle ukhetho lohulumeni basekhaya ekhala ngokuthi ayikaxazululwa eyemiphumela yango-2024. IMKP neKhomishini baya enkantolo ngenyanga ezayo lapho kuzokakanywa lesi sikhalazo seMKP ngokhetho lwango-2024."
Mhlengi Shangase,https://www.isolezwe.co.za/izindaba/2026-05-19-kufafazwa-eyeziqu-ezidingwa-ngumnotho-nabaqashi/,"Sikhulu isikhalo ngokwentuleka kwemisebenzi LISHUNYAYELWA emphakathini ehlukene kuleli kubalwa nakubafundi eyokuqedwa kwemikhakha emidala kwezemfundo nengenasidingo njengoba kufuqwa eyemikhakha emisha, edingwa ngumnotho kanjalo nabaqashi. Leli vangeli lifafazwa wuhlaka iSouth African Qualifications Authority, esemkhankasweni wokuhambela izifundazwe ezehlukene kuleli ihlangana nemiphakathi ehlukene ngale mikhakha. UDkt Makhapha Makhafola isikhulu seSAQA, uthe ngalo mkhankaso bafuna ukuqwashisa abantu ikakhulu intsha ngemikhakha emisha ekhona kuleli. Uthe kuphelile ngezinye zeziqu ebezifundwa kwezinye zezikhungo zemfundo okubalwa namakolishi amakhono ama-Technical Vacational Education and Training (TVET). ""Sihambela izifundazwe ezehlukene lapho esingagcini nje ngokukhuluma ngemikhakha edingwa abaqashi kanjalo nomnotho, kodwa sixwayisa nangezinye izinto okubalwa iziqu zomgunyathi nomthelela wazo. Sifuna abaqeda ukufunda bangabhuquzi emakhaya bagcine bengazi ukuthi bazokwenzani kodwa benze izinto ezidingekayo kuleli,"" usho kanje ekhuluma neNewzroom Afrika. Usho lokhu nje amaTVET aqede eminye yemikhakha eyayenziwa njengoba esenzisa emisha. Phakathi kwemikhakha emisha kubalwa eyokucwala izinwele, eyokudayisa, ethinta ugesi nokukhanda izimoto, eyokwakha, eyobuchwepheshe bamakhompyutha. Ezikoleni kuqaliwe kufundwa izifundo ezintsha okubalwa neCoding and Robotics ukuze abafundi babe nolwazi zisuka amadaka ngalezi zifundo. UMakhafola uthe basebenzisana nomnyango weMfundo ePhakeme okuyiwo osebenzisana nezikhungo ekufundiseni le mikhakha. ""Odabeni oluthinta iziqu ezingumgunyathi, sixwayisa abanazo nabacabanga ukwenza lo mkhonyovu ukuthi bagawule babheke. Asisineki uma ubanjwa neziqu zomgunyathi."" Uthe labo abaneziqu ezindala abangatatazeli ngoba akusho ukuthi azisenasisindo. ""Siwuhlaka olugcina ulwazi lwawo wonke umuntu oneziqu kuleli. Uma uneziqu ezindala akusho ukuthi azisenasidingo. Kunabasano-matric omdala, okungasho ukuthi abakwazi ukuqhuba izifundo zabo noma bathole umsebenzi ngoba sekukhona u-matric omusha manje. Ngalokhu sithi phansi amaphaphu kulabo abaneziqu ezindala ngoba akusho ukuthi kuphelile ngabo,"" usho kanje."
Mhlengi Shangase,https://www.isolezwe.co.za/izindaba/2026-05-18-bafuna-kukhishwe-othisha-bakwamanye-amazwe-abafundisa-izilimi-zakuleli/,"KUKHALWA ngothisha abavela kwamanye amazwe, asebeqashelwe ukufundisa izilimi zakuleli, ekubeni kunothisha ababhuquza emakhaya abangasebenzi. Lesi sikhalo sivezwe amalungu ePhalamende, akhale ngokuthi kwezinye izifundazwe kuqashwe othisha abavela kwamanye amazwe, abafundisa izifundo ezithathwa njengezingadingi ubuchule obuthile. UMqondisi jikelele eMnyangweni weMfundo eyisiSekelo uMnuz Mathanzima Mweli, uthe utholile ukuthi kwezinye izifundazwe othisha abavela kwamanye amazwe bafundisa izilimi zomdabu. ""Sike saba nenkinga yokuthi sidinga othisha abazofundisa izifundo ezifana neMaths neSayensi. Othisha bakwamanye amazwe kumele bathathwe uma bezofundisa lezi zifundo hhayi ukuthi bafundise izilimi zakuleli. Kwezinye izifundazwe engizihambele, ngithole ukuthi othisha bakwamanye amazwe abafundisi izifundo ezifana neMaths neSayensi, kodwa sebefundisa izifundo ezingadingi ubuchule namava athile ezifana nezilimi. Ngiyavumelana nabathi kumele kulezi zikhala kufakwe othisha bakuleli abangasebenzi,"" kusho uMweli, ekhuluma emhlanganweni wekomiti muva nje. UMnuz Siphetho Mkhize weqembu iMKP, ukhale ngokuthi baningi othisha abavela kwamanye amazwe abangafundisi izifundo ezifana neMaths neSayensi. ""Kumele kuqashwe inqwaba yothisha bakuleli abahleli emakhaya ngoba bengenawo umsebenzi. Akukwazi ukuthi ezifundweni ezifana nezingadingi ubuchule obutheni, kufundise abantu abavela kwamanye amazwe ekubeni bekhona abantu kuleli abagogodile,"" usho kanje. UMweli uvumelene noMkhize wathi kumele le nkinga ibhekwe kabanzi. Othisha abangasebenzi bahlale bemashela umnyango wezemfundo ikakhulu KwaZulu-Natal, befuna ukuqashwa. Umnyango wesifundazwe uhlale uveza izingqinamba zesabelomali esingenele esenza ungakwazi ukuqasha othisha. Ubuye waveza ukuthi kumele kuqiniswe kakhulu ekubhekeni uhlelo lokukhokhelwa kwabasebenzi kuhulumeni, iPersal njengoba ngesikhathi kwenziwa ucwaningo ngabasebenzi bahulumeni, kuvele ukuthi abanye ulwazi lwabo alukho kwiPersal. Umkhandlu okubhungwa kuwona izindaba zothisha i-Education Labour Relations Council, wenze ucwaningo obelufuna ukuhlonza izipoki zabasebenzi kwezemfundo, kanti bangu-438 000 ababhekiwe ukuthi ngempela badla anhlamvana. Ucwaningo lwenziwe ezikoleni ezingu-21 174, kubafundi abangu-11.7 million. Ucwaningo luveze ukuthi kunemininingwane yabasebenzi ababalelwa ku-22 409 kwiPersal, eshayisanayo. Abanye kuthiwa bavela ukuthi baqashwe ezifundazweni ezimbili. Lezi ngezinye zezinto okumele ziphenyisiswe. UMnyango weMfundo eWestern Cape, awuzange ube yingxenye yokwenziwa kocwaningo, okungenye yezinto ekhalise amalungu ePhalamende."
Mhlengi Shangase,https://www.isolezwe.co.za/izindaba/2026-05-18-isexwayiso-ngamanzi-komasipala-abangakhokhi/,"KUKHISHWE isexwayiso komasipala abahluleka ukukhokhela amabhodi ahlinzeka ngamanzi kuleli ukuthi abantu bangagcina sebethola amanzi angekho ezingeni, ngenxa yokukhula kwesikweletu. Lesi sexwayiso sikhishwe nguNgqongqoshe wezaManzi nokuHanjiswa kweNdle, uNksz Pemmy Majodina, ngesikhathi ethula isabelomali sika-R22 billion sonyakamali u-2026/2027 ePhalamende. Uthe sinyukile isikweletu somasipala abakweleta amabhodi amanzi saya ku-R27 billion. ""Isikweletu sinyuke saya ku-R27 billion, sisuka ku-R25 billion. Ukungakhokhi kwalabo masipala kungenza ukuthi abantu bagcine sebethola amanzi angekho ezingeni elifanele."" Uthe amanzi ayilungelo labantu ngakho abakwazi ukuwavala komasipala abakweletayo. ""Zikhona izinto ezingenziwa komasipala abakweleta amabhodi ahlinzeka ngamanzi, okubalwa nokuwavala. Manje asikwazi ukuvalela abantu amanzi ngoba ayilungelo labo."" Uthe zikhona izinhlelo ezenziwayo okubalwa nokuthi babanjelwe ingxenye yesabelomali omasipala abahluleka ukukhokha. ""Kumanje bangu-62 omasipala ababanjelwa ingxenye yesabelomali ukuze kukhokhelwe amabhodi amanzi. Zikhona nezingxoxo ezibekhona ebezihlanganisa oNdunankulu bezifundazwe, izimeya kanjalo nomnyango wezokuBusa ngokuBambisana neziNdaba zoMdabu, ngodaba lwezikweletu zomasipala."" Uthe kunemiphakathi esabhekene nezinselelo zokuthola amanzi ekubeni ingqalasizinda yamanzi ikhona. ""Abantu abawatholi amanzi, amanye ayavuza amosheke. Lezi ngezinye zezinkinga esizilungisayo."" Uthe bayalwa nenkohlakalo ethinta ukusatshalaliswa kwamanzi kuleli. ""Kunenkinga yama-mafia enza ubugebengu nenkohlakalo ngokuthi acekele phansi ingqalasizinda yamanzi kuleli. Lezi ngezinye zezingqinamba ezenza amanzi angafinyeleli kubantu. Kunezinhlelo ezifaka izinhlaka ezehlukene okunguhulumeni, umkhakha ozimele, uphiko oluphenya amacala i-Special Investigating Unit, nezinye ukulwa nale nkinga."" Uthe kunengqalazinda yamanzi esiphothuliwe enye isalungiswa ezindaweni ezehlukene kuleli. Ubale IMaphumulo Bulk Scheme KwaZulu-Natal, Giyani Water Project, Babanana Bulk Scheme, Moretele Bulk Scheme nezinye izindawo athe ingqalasizinda yamanzi isiphothuliwe. ""Siyazi kunezindawo ezibalelwa ku-2 600 ezihlala abantu ezingenawo nhlobo amanzi kuleli. Kulezi zindawo sinezinhlelo zokulanda amanzi ngaphansi komhlaba nezinye izinhlelo ukuze bathole amanzi."" Ezinye zalezi zindawo uthe ziseKZN wathi bakha ama-borehole angu-28, e-Eastern Cape bakha angu-14 kanjalo nakwezinye izindawo. Uveze ukuthi i-United Nations, iqoke elakuleli neFrance ukuthi ilungiselele ukubambisana kwesikasihlalo ngezithinta ukutshalwa kwemali kwingqalasizinda yamanzi engqungqutheleni ezoba ngoDisemba nonyaka. Ingqungquthela izobanjwa ngokubambisana i-United Arab Emirates neSenegal."
Mhlengi Shangase,https://www.isolezwe.co.za/izindaba/2026-05-18-uramaphosa-uzohlonipha-izingwazi-zakuleli/,"U-DJ Oskido ozohlonishwa nguMengameli Cyril Ramaphosa KUZOHLONISHWA amaciko ahlukene okubalwa nababhali bezincwadi nguMengameli Cyril Ramaphosa, emcimbini wama-National Orders. Kulo mcimbi kusuke kubungazwa izingwazi ezahlukene zakuleli nezakwamanye amazwe, esezalala kanjalo nezisadla anhlamvana ngemisebenzi emihle eziyenzayo emikhakheni ehlukene. Emcimbini wakusasa kuzohlonishwa amaciko okubalwa uqolothakamango ka-DJ, u-Oscar ""Oskido"" Mdlongwa, ngeqhaza lakhe ekufukuleni amaciko asafufusa endimeni yomculo. Ayaziwa amagalelo ka-Oskido emculweni we-kwaito kanti uphinde abe ngusomabhizinisi kanjalo nomsakazi. Omunye wabazohlonishwa yisihlabani somculi we-jazz, u-Jonathan Kenneth Butler odabuka eKapa. Ayaziwa amava kaButler emculweni we-jazz kuleli nasemhlabeni jikelele. Kuzophinde kuhlonishwe noqweqwe lombhali wezincwadi, uSolwazi Deuteronomy Bhekinkosi Zeblon Zulu, odume ngelika-DBZ Ntuli. UNtuli ubhale inqwaba yezincwadi ezifundwa nasezikoleni kuleli. Omunye wemisebenzi yakhe emenze wahlonishwa incwadi ayihumusha kaNelson Mandela, esihloko sithi Uhambo Olude Oluya eNkululekweni (Long Walk to Freedom). UNtuli uphinde abe ngomunye wabasunguli benhlangano yababhali eyaziwa ngokuthi Usiba Writers' Guild. INKAKHA ye-jazz uJonathan Butler Image: Shelley Kjonstad Kwezemidlalo kuzohlonishwa nomqeqeshi wamaBhokobhoko uRassie Erasmus, ngokuhola leli qembu ekutheni liwine indebe yomhlaba ebholeni lombhoxo. URamaphosa uzophinde ahloniphe noSolwazi Khabajane (Khabi) Vivian Mngoma ongasekho, ngeqhaza lakhe ekusunguleni umnyango wezomculo enyuvesi yaseZululand, oNgoye ngo-1975. UMngoma uhlonishwa nangeqhaza lakhe emculweni. Kuzohlonishwa nesishoshovu samalungelo abaphila nokukhubazeka u-Andiswa Gebashe, owaziwa ngokutolikela abangezwa uma kukhuluma uRamaphosa. Bonke laba bazohlonishwa nge-Order of Ikhamanga ngemisebenzi yabo kwezobuciko, umculo, ezemidlalo kanjalo nezokucoshelwa kwezindaba. UShansela wamaNational Orders, onguMqondisi jikelele ehhovisi likamengameli, uNksz Phindile Baleni, uthe inhloso yalo mcimbi ukuhlonipha abantu abenze imisebenzi encomekayo kuleli, abagqugquzela intando yeningi nabaphinde bafukule abantu bakuleli. Uthe kuhlonishwa abantu abahlukene ngezindondo okungeye-Ikhamanga, Baobab, Mapungubwe, neka-OR Tambo. Abanye abazohlonishwa ngendondo iMapungubwe oSolwazi Salim Abdool Karim waseNyuvesi yaKwaZulu-Natal, obambe iqhaza empini yokutholakala kwekhambi lokulapha ingculazi. UKarim wayesethimbeni elalijutshwe nguNgqongqoshe wezeMpilo kuleli, ukululeka izwe ngesikhathi kuhlasele umbulalazwe wegciwane iCovid-19. Kuzohlonishwa noSolwazi Tulio de Oliveira, ngocwaningo alwenza ethola olunye uhlobo lwegciwane lwe-Covid-19, olwalwaziwa nge-Omicron. Lolu cwaningo lwasiza ekuvikeleni abantu ukuthi bangasuleleki ngalolu hlobo lwegciwane. UNksz Baleni uhalalisele bonke abazohlonishwa wanxusa ukuthi baqhubeke nemisebenzi emihle abayenzayo ezweni."
Mhlengi Shangase,https://www.isolezwe.co.za/izindaba/2026-05-18-uhlelo-lokuqeda-ukugebenga-ngomazisi-abadala/,"UMNYANGO wezaseKhaya uqinisa izinhlelo zokukhipha omazisi ama-smart ID ukulwa nenkohlakalo yokukhwatshaniswa kwemininingwane yabasaphatha omazisi abadala. Babalelwa ku-16 million abantu bakuleli abasasebenzisa omazisi abadala abaluhlaza. Lokhu kuvezwe nguNgqongqoshe woMnyango, uDkt Leon Schreiber, ngesikhathi ethula isabelomali sika-R13.8 billion salo Mnyango ePhalamende. Uthe bandisa izindawo abantu abazokwazi ukushaya kuzona omazisi ama-smart ID njengoba behlela ukuthi kuphele unyaka, bebe sebeshaywa emagatsheni angu-750 amabhange akuleli. ""Sekuthatha imizuzu emihlanu ukushaya omazisi emabhange. Okwamanje angu-167 amabhange enza lo msebenzi esihlele ukunyusa isibalo sawo ungakapheli lo nyaka. Sifuna ukuqeda inkohlakalo yokwebiwa kolwazi lwalabo abasasebenzisa omazisi abadala. Labo mazisi abadala ibona abakhwatshaniswa kakhulu e-Afrika,"" usho kanje. UMnuz Njabulo Nzuza oyiPhini likaNgqongqoshe uthe onyakenimali u-2025/2026, baqophe umlando ngokukhipha ama-smart ID evile ku-4 milllion. Uthe bandise amahhovisi okushaywa kuwo omazisi, wathi kube nezinhlelo zokuhambela imiphakathi esemakhaya ukuyazisa ngalolu hlelo. ""Ukubambisana kwezinhlaka ezehlukene ikhona okwenze sakwazi ukukhipha omazisi abangaka. Sihambele imiphakathi esemakhaya nehlala ezindaweni ezikude."" USchreiber uthe maduzane bahlela ukufaka uhlelo lokushaywa kwama-passports emabhange. ""Sifuna ukuthi omazisi nama-passports alethwe emakhaya. Kuzobe kungokokuqala emlandweni ukuthi kwenzeke into efuze le kuleli. Abantu sifuna bakwazi ukuthi bathunyelelwe labo mazisi nama-passports kusetshenziswa uhlelo lwe-courier, bangaze baye emahhovisi ethu."" Udalule nokuthi masonto onke bakhomba indlela noma babopha abasebenzi abakhohlakele abasebenza ngaphansi kweBorder Management Authority (BMA). ""Selokhu ngiqale eMnyangweni, bevile ku-14 abasebenzi ababoshiwe, kwaxoshwa abangu-65, kwagwetshwa abangu-10 ngamacala ahlukene kwabasebenza kwiBMA. Asibafuni abasebenzi abakhohlakele njengoba sisemkhankasweni wokubuyisela emuva abantu bakwamanye amazwe abakuleli ngokungemthetho. Bevile ku-110 000 esesibabuyisele emazweni kanti bevile ku-945 000 esibavimbe ngempumelelo bangakwazi ukungena kuleli."" UNzuza uthe baqinisa nasekubhaliseni izingane ingakapheli inyanga zizelwe. ""Njengoba kuzovotwa, nginxusa abantu ukuthi balande omazisi babo emahhovisi ethu. Kubalulekile ukwenza lokhu ukuze bakwazi ukubamba iqhaza okhethweni,"" kusho uNzuza. Amanye amalungu ePhalamende akhale ngokuthi uma kubuyiselwa abantu abakuleli ngokungemthetho kugxilwa kwabantu abamnyama ekubeni bekhona nabezinye izinhlanga."
Mhlengi Shangase,https://www.isolezwe.co.za/izindaba/2026-05-18-kuqiniswa-izinhlelo-zolimo-emajele-kuncishiswa-isabelomali/,"Kuqiniswa izinhlelo zokuzenzela ukuze kuncishiswe imali UQINISA ezinhlelweni zolimo, ezokukhiqiza izinto ezehlukene kanjalo nakwezamakhono uMnyango wezokuHlunyeleliswa kweziMilo, kulandela ukuncishiswa kwesabelomali. Isabelomali salo nyakamali u-2026/2027, sincishiwe ngo-R683.4 million, njengoba singu-R30 billion. Lokhu kuvezwe nguNgqongqoshe woMnyango, uDkt Pieter Groenewald, ngesikhathi ethula isabelomali salo Mnyango ePhalamende. Uthe ngeke basonge izandla bangenzi lutho bakhalaze ngokuncishiswa kwesabelomali. ""Sifuna ukuzimela ngokuthi siqinise kwezolimo, ezokukhiqiza kanjalo nezinye izinto ngoba zinyuka njalo izindleko. Sihlinzeka nangamakhono iziboshwa ukuze zikwazi ukuzimela uma zidedelwa ezikhungweni zethu,"" usho kanje. Uthe sebevule amabhikawozi angu-12 ezikhungweni ezehlukene. ""Eka-13 kulindeleke ukuthi iqale ukusebenza kulo nyaka wezimali ejele iQalakabusha. Songe u-R77.1 million wokuthenga izinkwa onyakenimali u-2025/2026 ngenxa yamabhikawozi asezikhungweni zethu."" Uthe ezikhungweni ezehlukene kukhiqizwa izitshalo, inyama, ubisi kanti benza nefenisha. ""Kuthungwa nemifaniswano neminye imikhiqizo. Lokhu kusenza ukuthi singathembeli ekuthengeni njalo izinto kodwa sizenzele."" Uthe kusuka ngo-Ephreli nyakenye kuya kuFebhuwari nonyaka, isikhungo iWitbank Textile senze imifanisawno engu-40 869. ""Lesi sibalo sinyukile uma usiqhathanisa neminyaka edlule. Songe u-R125 million ngemikhiqizo yezolimo."" Udalule nokuthi bahlinzeka eminye iminyango kahulumeni ngefenisha. ""Sithole ama-order abalelwa enanini elingaphezu kuka-R100 000, onyakenimali u-2025/2026. Iminyango esisebenzisana nayo kubalwa owezaManzi, owezokuVikela, owezemiSebenzi yoMphakathi, owezobuLungiswa neminye. Akwanele lokhu yingakho nginxenxa neminye iminyango ukuthi ibambisane nathi ukuze sisebenzisane."" Uthe baxoxa noMnyango weMfundo eyisiSekelo ukuze bawakhele ama-deski abafundi. Utshele amalungu ePhalamende ukuthi ubuyisa uhlelo lokuklomelisa ngezindondo izisebenzi ezineminyaka ziyibambile emnyangweni. ""Sizoklomelisa abaneminyaka engu-10, 20, 30 na-40. Sifuna ukubahlonipha ngemisebenzi yabo emihle abayenzayo eMnyangweni."" Uthe uxoxile nezikhulu zamajele ahlukene kuleli ukuze kuqiniswe ezokulawulwa kwalezi zikhungo. ""Ngiyalele uKhomishana wamajele ukuthi kubuyekezwe eyokuqeqeshwa kwezikhulu ezenza umsebenzi obalulekile, kubhalwe izivivinyo njalo ngonyaka ukuze sibone ukuthi zisakulungele ukulawula lezi zikhungo. Sifuna ukuthi zilandele yonke imigomo yoMnyango."""
Mhlengi Shangase,https://www.isolezwe.co.za/izindaba/2026-05-18-ngeke-ziphazamiseke-ezika-matric-ngokhetho-iec/,"Image: Armand Hough / Independent Newspapers IKHOMISHINI yezoKhetho isiqinisekise ukuthi azizophazamiseka izivivinyo zika-matric uma sekuvotwa. Ikhomishini ithe yenze izinhlelo noMnyango wezeMfundo eyisiSekelo, ukuze izivivinyo zingaphazamiseki ngosuku lokhetho lohulumeni basekhaya ngoNovemba 4, 2026. Okunye okuvezwe yikhomishini ngukuthi yengezelwe isabelomali ngo-R1.1 billion wokhetho. Lokhu kuvele ngesikhathi izikhulu zekhomishini zivele ngaphambi kwekomiti lasePhalamende. USihlalo wekomiti i-Appropriations ePhalamende, uDkt Mmusi Maimane, uthe kubaqinisa idolo ukwazi ukuthi izivivinyo ezibaluleke kangaka ekhalendeni lezikole, ngeke ziphazamiseke. ""Ukhetho luzobanjwa ngesikhathi esimatasa sokubhalwa kwezivivinyo. Kuyasijabulisa ukuthi usuku lokhetho kuzoba yiholidi ngakho ngeke ziphazamiseke izivivinyo,"" kusho uMaimane. Uthe izikhungo eziningi okuvotelwa kuzona yizikole ngakho bebekhathazekile ngokuthi kuzokwenzakalani ngezivivinyo. UNksz Dawn Mbatha, isikhulu esiphethe izimali kwikhomishini, uthe isimo sabo sezimali sihle njengoba bethole uchatha. ""Ngaphambi kokuba sisebenzise imali kudingeka silethe izitatimende zokusebenza kwemali ungakashayi uJulayi 31. Lo chatha usuvele ungakuthina sesilinde ukuwusebenzisa."" Kuzokhumbuleka ukuthi ikhomishini yahlinzekwa ngesabelomali sika-R3.2 billion sezinhlelo zokhetho. Le mali eyokusiza kugaywe amaphepha okuvota, ukukhokhela abasebenzi abengeziwe abazosebenza ngesikhathi sokhetho kanjalo nokwenza ezinye izinhlelo ezithinta ukhetho. UMaimane unxuse ikhomishini ukuthi iqinise imikhankaso yokunxenxa abantu ikakhulu intsha ukubhalisela ukuvota. ""Liphansi kakhulu izinga lentsha ezibandakanya nokuvota kuleli. Sinxusa nokuthi igade abantu abasabalalisa izinto okungezona ezinkundleni zokuxhumana ngokhetho."" Iphini lesikhulu esiphezulu sekhomishini uMnuz Masego Sheburi, lithe ahamba ngohlelo amalungiselelo okhetho. ""Sihlabela phambili namalungiselelo njengoba kuzoba nempelasonto yokubhalisela ukuvota."" Angaphezu kuka-500 amaqembu abhalisile kuleli kanti angu-20 wawo, abhaliswe kusuka ngo-Okthoba 2025 kuya kuFebhuwari 2026."
